,Unnamed: 0,sql_id,nl_query,sql,GT_sql,tianyi,record_id_x,tianyi_code,zhengn,record_id_y,zhengn_code
539,539,1931,What are the name and primarily affiliated department name of each physician?,"SELECT Physician.Name, Affiliated_With.PrimaryAffiliation FROM Physician JOIN Affiliated_With ON Physician.EmployeeID = Affiliated_With.Department JOIN Department ON Affiliated_With.Department = Department.DepartmentID","SELECT T1.name ,  T3.name FROM physician AS T1 JOIN affiliated_with AS T2 ON T1.EmployeeID  =  T2.physician JOIN department AS T3 ON T2.department  =  T3.DepartmentID WHERE T2.PrimaryAffiliation  =  1",tianyi,2941dc27-8aed-4e24-bf96-369c577315ca,"BL1, BE5, F4",zhengning,d4f888a3-c6ed-488b-95a7-f4b870d8491b,"CF5, F4"
540,540,1934,How many patients' prescriptions are made by physician John Dorian?,"SELECT COUNT(*) FROM Physician JOIN Prescribes ON Physician.EmployeeID = Prescribes.Physician WHERE Physician.Name = ""John Dorian""","SELECT count(T1.SSN) FROM patient AS T1 JOIN prescribes AS T2 ON T1.SSN  =  T2.patient JOIN physician AS T3 ON T2.physician  =  T3.employeeid WHERE T3.name = ""John Dorian""",tianyi,113748c0-6dc9-49b6-bd61-e709ac44a455,"BL2, CE2",zhengning,7f15b439-7eec-4cb7-96a7-8dd3ffa2aa03,"BL1, CE2"
541,541,1935,Find the number of patients' prescriptions physician John Dorian made.,"SELECT COUNT(*) FROM Physician JOIN Prescribes ON Physician.EmployeeID = Prescribes.Physician WHERE Physician.Name = ""John Dorian""","SELECT count(T1.SSN) FROM patient AS T1 JOIN prescribes AS T2 ON T1.SSN  =  T2.patient JOIN physician AS T3 ON T2.physician  =  T3.employeeid WHERE T3.name = ""John Dorian""",tianyi,c682edde-cd72-4909-9ba0-4e41e069df94,"BL2, CE2",zhengning,3810e878-ec66-4812-9821-e471eb05f80e,"BL1, CE2"
542,542,1939,List the names of all the physicians who prescribe Thesisin as medication.,"SELECT Physician.Name FROM Physician JOIN Prescribes ON Physician.EmployeeID = Prescribes.Physician JOIN Medication ON Prescribes.Medication = Medication.Code WHERE Medication.Name = ""Thesisin""","SELECT DISTINCT T1.name FROM physician AS T1 JOIN prescribes AS T2 ON T1.employeeid = T2.physician JOIN medication AS T3 ON T3.code = T2.medication WHERE T3.name  =  ""Thesisin""",tianyi,9d2754b7-7b20-4b7f-b35a-69441332f7e6,A1b,zhengning,51452e30-5c2d-43ac-9e68-d8d4c547fb54,A1b
543,543,1942,Find the names of all patients who have an undergoing treatment and are staying in room 111.,SELECT DISTINCT Patient.Name FROM Patient JOIN Undergoes ON Patient.SSN = Undergoes.Patient WHERE Undergoes.AssistingNurse = 111,SELECT DISTINCT T2.name FROM undergoes AS T1 JOIN patient AS T2 ON T1.patient = T2.SSN JOIN stay AS T3 ON T1.Stay  =  T3.StayID WHERE T3.room  =  111,tianyi,e455147b-46d4-4652-b4f7-460cec82cdab,"CE2, BF4",zhengning,28d25373-7c13-4773-8d0e-81a447fd9122,"CE2, BF4"
544,544,1944,What are the names of the physician who prescribed the highest dose?,SELECT Nurse.Name FROM Nurse JOIN Prescribes ON Nurse.EmployeeID = Prescribes.Physician ORDER BY Prescribes.Dose DESC LIMIT 1,SELECT T1.name FROM physician AS T1 JOIN prescribes AS T2 ON T1.employeeid = T2.physician ORDER BY T2.dose DESC LIMIT 1,tianyi,2012757f-afba-49c2-a961-bbacf46ce151,CE2,zhengning,10403945-b2cc-4a4c-99ef-7f1033f4a936,"CL1, CE3"
545,545,1945,Find the physician who prescribed the highest dose. What is his or her name?,SELECT Patient.Name FROM Patient JOIN Prescribes ON Patient.SSN = Prescribes.Patient ORDER BY Prescribes.Dose DESC LIMIT 1,SELECT T1.name FROM physician AS T1 JOIN prescribes AS T2 ON T1.employeeid = T2.physician ORDER BY T2.dose DESC LIMIT 1,tianyi,a0f05c9c-d7b9-4f5c-a44f-9bf6ccc4de1f,"BE5, CL1",zhengning,54cfc0c7-1cda-4595-8027-a3af8a25a846,"CL1, CE3"
546,546,1946,Find the physicians who are trained in a procedure that costs more than 5000.,SELECT Trained_In.Physician FROM Trained_In JOIN Procedures ON Trained_In.Physician = Procedures.Code WHERE Procedures.Cost > 5000,SELECT T1.name FROM physician AS T1 JOIN trained_in AS T2 ON T1.employeeid  =  T2.physician JOIN procedures AS T3 ON T3.code  =  T2.treatment WHERE T3.cost  >  5000,tianyi,acee710d-65ba-491f-9eb7-ede9f6cc5d65,"BL1, BE5, CL1, CE2",zhengning,c171f1d7-32fe-48d7-989b-1c4374961644,"CL1, CE3"
547,547,1947,Which physicians are trained in procedures that are more expensive than 5000?,SELECT Trained_In.Physician FROM Trained_In JOIN Procedures ON Trained_In.Physician = Procedures.Code WHERE Procedures.Cost > 5000,SELECT T1.name FROM physician AS T1 JOIN trained_in AS T2 ON T1.employeeid  =  T2.physician JOIN procedures AS T3 ON T3.code  =  T2.treatment WHERE T3.cost  >  5000,tianyi,5f10e07d-1214-4f54-843f-df5a18efa0fa,"BL1, CE2, BE5, CL1",zhengning,50d0fd15-d035-4a57-924a-7e05ebe14f24,"CL1, CE3"
548,548,1948,What is the average cost of procedures that physician John Wen was trained in?,SELECT * FROM Physician,"SELECT avg(T3.cost) FROM physician AS T1 JOIN trained_in AS T2 ON T1.employeeid  =  T2.physician JOIN procedures AS T3 ON T3.code  =  T2.treatment WHERE T1.name  =  ""John Wen""",tianyi,024c0c8a-f48a-493d-8edf-59e05d0454e0,"CE2, F4, BL2",zhengning,dd9e3655-bc6a-4472-9801-6ac69edf9ce9,"CE2, F4, BL2"
549,549,1949,Compute the mean price of procedures physician John Wen was trained in.,"SELECT AVG(Procedures.Cost) FROM Physician JOIN Trained_In ON Physician.EmployeeID = Trained_In.Physician JOIN Procedures ON Trained_In.Physician = Procedures.Code WHERE Physician.Name = ""John Wen""","SELECT avg(T3.cost) FROM physician AS T1 JOIN trained_in AS T2 ON T1.employeeid  =  T2.physician JOIN procedures AS T3 ON T3.code  =  T2.treatment WHERE T1.name  =  ""John Wen""",tianyi,dce939aa-aed0-4825-950a-c927573bb28e,BE5,zhengning,35115aa6-c926-4a79-8a8c-37056735faaf,BE5
550,550,1950,Find the names of procedures which physician John Wen was trained in.,"SELECT DISTINCT Procedures.Name FROM Trained_In JOIN Physician ON Trained_In.Physician = Physician.EmployeeID JOIN Procedures ON Procedures.Code = Physician.SSN WHERE Physician.Name = ""John Wen""","SELECT T3.name FROM physician AS T1 JOIN trained_in AS T2 ON T1.employeeid  =  T2.physician JOIN procedures AS T3 ON T3.code  =  T2.treatment WHERE T1.name  =  ""John Wen""",tianyi,9e897f5e-2629-4dc0-b7e9-bda47c604dba,"BE5, A2a",zhengning,19fec47d-1396-4285-9e67-75cb6f20fe48,"BE5, A2a"
551,551,1951,What are the names of procedures physician John Wen was trained in?,"SELECT DISTINCT Procedures.Name FROM Physician JOIN Trained_In ON Physician.EmployeeID = Trained_In.Physician JOIN Procedures ON Trained_In.Physician = Procedures.Code WHERE Physician.Name = ""John Wen""","SELECT T3.name FROM physician AS T1 JOIN trained_in AS T2 ON T1.employeeid  =  T2.physician JOIN procedures AS T3 ON T3.code  =  T2.treatment WHERE T1.name  =  ""John Wen""",tianyi,921932a1-ec2e-4ccb-befb-af4985e936e4,BE5,zhengning,03c4e744-c276-4ce7-9dbf-e6d4cfb67336,"BE5, A2a"
552,552,1952,Find all procedures which cost more than 1000 or which physician John Wen was trained in.,"SELECT Procedures.Name FROM Procedures JOIN Trained_In ON Procedures.Code = Trained_In.Treatment JOIN Physician ON Trained_In.Physician = Physician.EmployeeID WHERE Physician.Name = ""John Wen"" OR Procedures.Cost > 1000","SELECT name FROM procedures WHERE cost  >  1000 UNION SELECT T3.name FROM physician AS T1 JOIN trained_in AS T2 ON T1.employeeid  =  T2.physician JOIN procedures AS T3 ON T3.code  =  T2.treatment WHERE T1.name  =  ""John Wen""",tianyi,77eeba07-b2e1-4bba-bea2-8f16540aaccd,F2,zhengning,00fbac70-dc30-414a-8713-464d4440024d,F2
553,553,1953,What are the procedures that cost more than 1000 or are specialized in by physician John Wen?,SELECT Procedures.Name FROM Procedures WHERE Procedures.Cost > 1000 OR Procedures.Cost > 1000,"SELECT name FROM procedures WHERE cost  >  1000 UNION SELECT T3.name FROM physician AS T1 JOIN trained_in AS T2 ON T1.employeeid  =  T2.physician JOIN procedures AS T3 ON T3.code  =  T2.treatment WHERE T1.name  =  ""John Wen""",tianyi,1ddbba9c-8334-413f-9064-e0603c85d63e,"CE2, F3, F4",zhengning,18bd1152-2c80-48c6-87e3-c4ec43d95379,"F4, A1e"
554,554,1954,Find the names of all procedures which cost more than 1000 but which physician John Wen was not trained in?,SELECT Procedures.Name FROM Procedures WHERE Procedures.Cost > 1000 AND Procedures.Cost > 1000,"SELECT name FROM procedures WHERE cost  >  1000 EXCEPT SELECT T3.name FROM physician AS T1 JOIN trained_in AS T2 ON T1.employeeid  =  T2.physician JOIN procedures AS T3 ON T3.code  =  T2.treatment WHERE T1.name  =  ""John Wen""",tianyi,09f987d8-3b5b-4ebd-b369-762a257a69d0,"F3, F4, CE2",zhengning,6e9b3317-b8fb-4646-b7f2-ae21c47c941b,"F3, F4, A1d"
555,555,1956,Find the names of all procedures such that the cost is less than 5000 and physician John Wen was trained in.,SELECT Procedures.Name FROM Procedures WHERE Procedures.Cost < 5000 AND Procedures.Cost = 5000,"SELECT name FROM procedures WHERE cost  <  5000 INTERSECT SELECT T3.name FROM physician AS T1 JOIN trained_in AS T2 ON T1.employeeid  =  T2.physician JOIN procedures AS T3 ON T3.code  =  T2.treatment WHERE T1.name  =  ""John Wen""",tianyi,960dd052-4823-44fe-a26e-0ede67f4088d,"CE2, F4, F2",zhengning,56b3718f-4b3b-45eb-a2c0-cc36ab09014a,"F4, A1g"
556,556,1957,What procedures cost less than 5000 and have John Wen as a trained physician?,"SELECT Procedures.Name FROM Procedures JOIN Trained_In ON Procedures.Code = Trained_In.Treatment JOIN Physician ON Trained_In.Physician = Physician.EmployeeID WHERE Physician.Name = ""John Wen"" AND Procedures.Cost < 5000","SELECT name FROM procedures WHERE cost  <  5000 INTERSECT SELECT T3.name FROM physician AS T1 JOIN trained_in AS T2 ON T1.employeeid  =  T2.physician JOIN procedures AS T3 ON T3.code  =  T2.treatment WHERE T1.name  =  ""John Wen""",tianyi,9af926e0-a44f-4923-9308-e1cf37b96db0,F2,zhengning,bd1ede83-81cf-4623-9409-fe7a8c60d8c4,A1g
557,557,1959,What are the names of patients who are not taking the medication of Procrastin-X.,"SELECT Patient.Name FROM Patient WHERE Patient.SSN NOT IN (SELECT Prescribes.Patient FROM Prescribes JOIN Medication ON Prescribes.Medication = Medication.Code WHERE Medication.Name = ""Procrastin-X"")",SELECT name FROM patient EXCEPT SELECT T1.name FROM patient AS T1 JOIN Prescribes AS T2 ON T2.Patient  =  T1.SSN JOIN Medication AS T3 ON T2.Medication  =  T3.Code WHERE T3.name  =  'Procrastin-X',tianyi,012aaa38-dffc-455e-92f0-12becafcb7cd,"F4, A1d",zhengning,fb2845ef-4edf-405e-94e1-c9b17fc1ace1,"BE5, D1, A1d"
558,558,1967,Show the headquarters that have both companies in banking industry and companies in oil and gas industry.,"SELECT company.Headquarters FROM company WHERE company.Industry = ""banking"" INTERSECT SELECT company.Headquarters FROM company WHERE company.Industry = ""oil and gas""","SELECT Headquarters FROM company WHERE Industry  =  ""Banking"" INTERSECT SELECT Headquarters FROM company WHERE Industry  =  ""Oil and gas""",tianyi,1bfd3e81-39c3-429c-9100-2f03b3310e59,D1a,zhengning,4d90fc14-1916-474d-a319-8bf70dde3b13,D1a
559,559,1968,Show names of companies and that of employees in descending order of number of years working for that employee.,"SELECT company.Name, employment.People_ID FROM employment JOIN company ON employment.Company_ID = company.Company_ID ORDER BY employment.Year_working DESC","SELECT T3.Name ,  T2.Name FROM employment AS T1 JOIN people AS T2 ON T1.People_ID  =  T2.People_ID JOIN company AS T3 ON T1.Company_ID  =  T3.Company_ID ORDER BY T1.Year_working",tianyi,1421e534-e35a-4061-a72d-21dcde091cb8,"BL2, CL1, CE2, K2",zhengning,58c06b52-b487-4634-8766-cd429f41c025,"CL1, CE2, K2"
560,560,1969,Show the names of employees that work for companies with sales bigger than 200.,SELECT company.Name FROM employment JOIN company ON employment.Company_ID = company.Company_ID WHERE company.Sales_in_Billion > 200,SELECT T2.Name FROM employment AS T1 JOIN people AS T2 ON T1.People_ID  =  T2.People_ID JOIN company AS T3 ON T1.Company_ID  =  T3.Company_ID WHERE T3.Sales_in_Billion  >  200,tianyi,c6faaae9-6a41-4615-ac2d-d9ef482ddd4b,"CL1, CE2",zhengning,1c0b90c7-78a8-4cfd-8e8a-87ea069acc3f,"F3, F1, BL2, D1a, D1, A1e, CE2, CF5, F2, K2"
561,561,1970,Show the names of companies and the number of employees they have,"SELECT company.Name, COUNT(*) FROM employment JOIN company ON employment.Company_ID = company.Company_ID GROUP BY employment.Company_ID","SELECT T3.Name ,  COUNT(*) FROM employment AS T1 JOIN people AS T2 ON T1.People_ID  =  T2.People_ID JOIN company AS T3 ON T1.Company_ID  =  T3.Company_ID GROUP BY T3.Name",tianyi,38177966-b482-4e42-bf49-199d74f9c176,"BN1, CE2",zhengning,7bbd689c-14eb-4c70-a490-bb60cef05cfe,"CE2, BN1"
562,562,1978,"Show the studios that have produced films with director ""Nicholas Meyer"" and ""Walter Hill"".","SELECT film.Studio FROM film WHERE film.Director = ""Nicholas Meyer"" AND film.Director = ""Walter Hill""","SELECT Studio FROM film WHERE Director  =  ""Nicholas Meyer"" INTERSECT SELECT Studio FROM film WHERE Director  =  ""Walter Hill""",tianyi,57458871-6cfa-4e01-9a2b-4e70df3d244f,F2,zhengning,bd312c4a-ae53-43a0-99c7-5376dc1a9903,"A1g, F2"
563,563,1984,"Find the last names of the members of the club ""Bootup Baltimore"".","SELECT Student.LName FROM Student JOIN Member_of_club ON Student.StuID = Member_of_club.ClubID JOIN Club ON Member_of_club.ClubID = Club.ClubID WHERE Club.ClubName = ""Bootup Baltimore""","SELECT t3.lname FROM club AS t1 JOIN member_of_club AS t2 ON t1.clubid  =  t2.clubid JOIN student AS t3 ON t2.stuid  =  t3.stuid WHERE t1.clubname  =  ""Bootup Baltimore""",tianyi,122ebd7b-b852-4153-aa89-4ffd729a92bb,BE5,zhengning,52f3404c-6500-490c-94b2-627d1e288d3f,BE5
564,564,1985,"Who are the members of the club named ""Bootup Baltimore""? Give me their last names.","SELECT Club.ClubName FROM Member_of_club JOIN Club ON Member_of_club.ClubID = Club.ClubID JOIN Club ON Member_of_club.ClubID = Club.ClubID WHERE Club.ClubName = ""Bootup Baltimore""","SELECT t3.lname FROM club AS t1 JOIN member_of_club AS t2 ON t1.clubid  =  t2.clubid JOIN student AS t3 ON t2.stuid  =  t3.stuid WHERE t1.clubname  =  ""Bootup Baltimore""",tianyi,b3c0c55c-b3ff-482d-97eb-2a548df9ff54,"BL1, BE5, CL1, CE2",zhengning,143d04ec-a269-4018-b33b-5a66f5c4a4d0,"CL1, BE5"
565,565,1986,"Who are the members of the club named ""Hopkins Student Enterprises""? Show the last name.","SELECT Student.LName FROM Student JOIN Member_of_club ON Student.StuID = Member_of_club.ClubID JOIN Club ON Member_of_club.ClubID = Club.ClubID WHERE Club.ClubName = ""Hopkins Student Enterprises""","SELECT t3.lname FROM club AS t1 JOIN member_of_club AS t2 ON t1.clubid  =  t2.clubid JOIN student AS t3 ON t2.stuid  =  t3.stuid WHERE t1.clubname  =  ""Hopkins Student Enterprises""",tianyi,b2913dcf-2992-4da3-b27f-0b219433e543,"BL1, BE5",zhengning,0f031c18-9605-429c-b6d3-d13c0564aab4,BE5
566,566,1987,"Return the last name for the members of the club named ""Hopkins Student Enterprises"".","SELECT Student.LName FROM Student JOIN Member_of_club ON Student.StuID = Member_of_club.ClubID JOIN Club ON Member_of_club.ClubID = Club.ClubID WHERE Club.ClubName = ""Hopkins Student Enterprises""","SELECT t3.lname FROM club AS t1 JOIN member_of_club AS t2 ON t1.clubid  =  t2.clubid JOIN student AS t3 ON t2.stuid  =  t3.stuid WHERE t1.clubname  =  ""Hopkins Student Enterprises""",tianyi,619778a8-e713-4360-85ff-2182f68f6152,"BL1, BE5",zhengning,46fd2669-66f0-400d-b1e7-6b59466261bd,BE5
567,567,1988,"How many members does the club ""Tennis Club"" has?","SELECT COUNT(*) FROM Member_of_club JOIN Club ON Member_of_club.ClubID = Club.ClubID WHERE Club.ClubName = ""Tennis club""","SELECT count(*) FROM club AS t1 JOIN member_of_club AS t2 ON t1.clubid  =  t2.clubid JOIN student AS t3 ON t2.stuid  =  t3.stuid WHERE t1.clubname  =  ""Tennis Club""",tianyi,c9417743-5d1c-4e98-b518-902b2aa5d513,"BL1, CE2",zhengning,d9b69a68-ce4d-4425-a30d-f437dfa544fc,"CE2, D1a, CL1"
568,568,1989,"Count the members of the club ""Tennis Club"".","SELECT COUNT(*) FROM Member_of_club JOIN Club ON Member_of_club.ClubID = Club.ClubID WHERE Club.ClubName = ""Tennis club""","SELECT count(*) FROM club AS t1 JOIN member_of_club AS t2 ON t1.clubid  =  t2.clubid JOIN student AS t3 ON t2.stuid  =  t3.stuid WHERE t1.clubname  =  ""Tennis Club""",tianyi,00edcdda-121e-432e-bbae-939f47319a67,"BL1, CE2",zhengning,32d110fc-c38b-4e28-b703-dcfb253896ef,"CE2, D1a, CL1"
569,569,1996,"Find all the female members of club ""Bootup Baltimore"". Show the first name and last name.","SELECT Student.Fname, Student.LName FROM Member_of_club JOIN Student ON Member_of_club.ClubID = Student.StuID JOIN Club ON Member_of_club.ClubID = Club.ClubID WHERE Student.Sex = ""Bootup Baltimore"" AND Club.ClubName = ""female""","SELECT t3.fname ,  t3.lname FROM club AS t1 JOIN member_of_club AS t2 ON t1.clubid  =  t2.clubid JOIN student AS t3 ON t2.stuid  =  t3.stuid WHERE t1.clubname  =  ""Bootup Baltimore"" AND t3.sex  =  ""F""",tianyi,cb4e0b57-5f51-4130-b423-a20568b0aa5f,"BE5, D1",zhengning,d72ed4d9-6ad7-4227-b8fd-347806323e1e,"D1c, CF5, BE5"
570,570,1997,"Give me the first name and last name for all the female members of the club ""Bootup Baltimore"".","SELECT Student.Fname, Student.LName FROM Student JOIN Member_of_club ON Student.StuID = Member_of_club.StuID JOIN Club ON Member_of_club.ClubID = Club.ClubID WHERE Student.Sex = ""Bootup Baltimore"" AND Club.ClubName = ""VALUE VALUE female""","SELECT t3.fname ,  t3.lname FROM club AS t1 JOIN member_of_club AS t2 ON t1.clubid  =  t2.clubid JOIN student AS t3 ON t2.stuid  =  t3.stuid WHERE t1.clubname  =  ""Bootup Baltimore"" AND t3.sex  =  ""F""",tianyi,3fa897c5-2d0b-46b3-aae7-bb0d43701403,D1,zhengning,0595e19e-6942-45c7-8923-3dc3cd2e7f8f,"CF5, BE5, D1"
571,571,2002,"What are the first and last name of the president of the club ""Bootup Baltimore""?","SELECT Student.Fname, Student.LName FROM Member_of_club JOIN Club ON Member_of_club.ClubID = Club.ClubID JOIN Student ON Member_of_club.StuID = Student.StuID WHERE Club.ClubName = ""Bootup Baltimore""","SELECT t3.fname ,  t3.lname FROM club AS t1 JOIN member_of_club AS t2 ON t1.clubid  =  t2.clubid JOIN student AS t3 ON t2.stuid  =  t3.stuid WHERE t1.clubname  =  ""Bootup Baltimore"" AND t2.position  =  ""President""",tianyi,cfd796c8-109e-4a3a-8701-4e047f9f5f86,F4,zhengning,436f1d06-9c5b-4112-ba70-9cda1fa1a876,F4
572,572,2003,"Who is the president of the club ""Bootup Baltimore""? Give me the first and last name.","SELECT Club.ClubName FROM Member_of_club JOIN Club ON Member_of_club.ClubID = Club.ClubID WHERE Club.ClubName = ""Bootup Baltimore""","SELECT t3.fname ,  t3.lname FROM club AS t1 JOIN member_of_club AS t2 ON t1.clubid  =  t2.clubid JOIN student AS t3 ON t2.stuid  =  t3.stuid WHERE t1.clubname  =  ""Bootup Baltimore"" AND t2.position  =  ""President""",tianyi,5da2cc47-976f-4408-9007-e0adcc6acb15,"BL1, F4, CL1, CE2",zhengning,46c26f7b-af57-4d1f-b5b6-c41a378e2ad3,F4
573,573,2004,"Who is the ""CTO"" of club ""Hopkins Student Enterprises""? Show the first name and last name.","SELECT Student.Fname, Student.LName FROM Club JOIN Member_of_club ON Club.ClubID = Member_of_club.ClubID JOIN Student ON Member_of_club.StuID = Student.StuID WHERE Club.ClubName = ""Hopkins Student Enterprises"" AND Student.LName = ""CTO""","SELECT t3.fname ,  t3.lname FROM club AS t1 JOIN member_of_club AS t2 ON t1.clubid  =  t2.clubid JOIN student AS t3 ON t2.stuid  =  t3.stuid WHERE t1.clubname  =  ""Hopkins Student Enterprises"" AND t2.position  =  ""CTO""",tianyi,516b38dc-2d57-44ef-ba0f-29ce3fc4752a,,zhengning,50c19100-696a-45cc-965a-0af83c490308,CF5
574,574,2005,"Find the first name and last name for the ""CTO"" of the club ""Hopkins Student Enterprises""?","SELECT Student.Fname, Student.LName FROM Club JOIN Student ON Club.ClubID = Student.StuID WHERE Club.ClubName = ""Hopkins Student Enterprises"" AND Club.ClubName = ""CTO""","SELECT t3.fname ,  t3.lname FROM club AS t1 JOIN member_of_club AS t2 ON t1.clubid  =  t2.clubid JOIN student AS t3 ON t2.stuid  =  t3.stuid WHERE t1.clubname  =  ""Hopkins Student Enterprises"" AND t2.position  =  ""CTO""",tianyi,c04b7b8d-6fd5-4a7f-a057-f7dcaccb12c1,"BE5, BF4, CE2",zhengning,ca00cc3d-6b2d-431d-956d-ec5c7f233bff,"BF4, CE2"
575,575,2007,"Count the number of members in club ""Bootup Baltimore"" whose age is above 18.","SELECT COUNT(*) FROM Member_of_club JOIN Club ON Member_of_club.ClubID = Club.ClubID WHERE Club.ClubName = ""Bootup Baltimore"" AND Club.ClubName > 18","SELECT count(*) FROM club AS t1 JOIN member_of_club AS t2 ON t1.clubid  =  t2.clubid JOIN student AS t3 ON t2.stuid  =  t3.stuid WHERE t1.clubname  =  ""Bootup Baltimore"" AND t3.age  >  18",tianyi,446f7115-18b9-4115-b565-7dd153baedac,"BL1, BF4, CE2",zhengning,9796280c-b155-4004-b0cf-589802d699a5,"CE2, CF5, CL1"
576,576,2009,"Count the number of members in club ""Bootup Baltimore"" whose age is below 18.","SELECT COUNT(*) FROM Member_of_club JOIN Club ON Member_of_club.ClubID = Club.ClubID WHERE Club.ClubName = ""Bootup Baltimore"" AND Club.ClubName < 18","SELECT count(*) FROM club AS t1 JOIN member_of_club AS t2 ON t1.clubid  =  t2.clubid JOIN student AS t3 ON t2.stuid  =  t3.stuid WHERE t1.clubname  =  ""Bootup Baltimore"" AND t3.age  <  18",tianyi,8f8b8dc2-d04f-4f29-9a70-e0821b8cd53e,"BL1, BF4, CE2",zhengning,fd71094d-706a-4aee-bf8e-902112dbf391,"CE2, CF5, CL1"
577,577,2014,"How many clubs does the student named ""Eric Tai"" belong to?","SELECT COUNT(*) FROM Student JOIN Member_of_club ON Student.StuID = Member_of_club.StuID JOIN Club ON Club.ClubID = Member_of_club.ClubID WHERE Student.Fname = ""Eric"" AND Student.LName = ""Tai""","SELECT count(DISTINCT t1.clubname) FROM club AS t1 JOIN member_of_club AS t2 ON t1.clubid  =  t2.clubid JOIN student AS t3 ON t2.stuid  =  t3.stuid WHERE t3.fname  =  ""Eric"" AND t3.lname  =  ""Tai""",tianyi,49415f7e-e44d-4176-b0ea-179df3e7514a,"A1b, BL2",zhengning,742bc93f-981d-4517-b979-b3b1c0185759,CL1
578,578,2015,"Count the number of clubs for which the student named ""Eric Tai"" is a member.","SELECT COUNT(*) FROM Student JOIN Member_of_club ON Student.StuID = Member_of_club.StuID JOIN Club ON Member_of_club.ClubID = Club.ClubID WHERE Student.Fname = ""Eric"" AND Student.LName = ""Tai""","SELECT count(DISTINCT t1.clubname) FROM club AS t1 JOIN member_of_club AS t2 ON t1.clubid  =  t2.clubid JOIN student AS t3 ON t2.stuid  =  t3.stuid WHERE t3.fname  =  ""Eric"" AND t3.lname  =  ""Tai""",tianyi,a449b711-6407-4c9d-a34a-4e516676b575,"A1b, BL2, CL1",zhengning,d3ec3d7b-b5a2-4d55-ab63-d11b219fe7d1,CL1
579,579,2019,"Which clubs have one or more members whose advisor is ""1121""?",SELECT COUNT(*) FROM Club JOIN Member_of_club ON Club.ClubID = Member_of_club.ClubID JOIN Student ON Club.ClubID = Student.Advisor WHERE Student.Advisor = 1121,SELECT DISTINCT t1.clubname FROM club AS t1 JOIN member_of_club AS t2 ON t1.clubid  =  t2.clubid JOIN student AS t3 ON t2.stuid  =  t3.stuid WHERE t3.advisor  =  1121,tianyi,fd72f025-3b48-4b33-9ffa-c2300c89bfe3,"A1b, BE5, L4",zhengning,ad50d11e-6b1a-4215-8f8c-d1d079bdfeca,"BE5, L4, A1b"
580,580,2024,"Retrieve the average age of members of the club ""Tennis Club"".","SELECT AVG(Student.Age) FROM Member_of_club JOIN Student ON Member_of_club.StuID = Student.StuID JOIN Club ON Member_of_club.ClubID = Club.ClubID WHERE Club.ClubName = ""Tennis club""","SELECT avg(t3.age) FROM club AS t1 JOIN member_of_club AS t2 ON t1.clubid  =  t2.clubid JOIN student AS t3 ON t2.stuid  =  t3.stuid WHERE t1.clubname  =  ""Tennis Club""",tianyi,fcd61044-44b8-4610-b56c-79cd8df96eb3,D1a,zhengning,07206bb6-1db9-4591-932c-6ffc977aec1a,D1a
581,581,2025,"Compute the average age of the members in the club ""Tennis Club"".","SELECT AVG(Student.Age) FROM Member_of_club JOIN Student ON Member_of_club.StuID = Student.StuID JOIN Club ON Member_of_club.ClubID = Club.ClubID WHERE Club.ClubName = ""Tennis club""","SELECT avg(t3.age) FROM club AS t1 JOIN member_of_club AS t2 ON t1.clubid  =  t2.clubid JOIN student AS t3 ON t2.stuid  =  t3.stuid WHERE t1.clubname  =  ""Tennis Club""",tianyi,2c641310-ab9e-4f0f-9c0a-349c6fb55fd2,D1a,zhengning,d967b586-3c0a-4b26-b52c-4e99070235dc,D1a
582,582,2026,What is the total grant amount of the organisations described as research?,"SELECT SUM(Grants.grant_amount) FROM Grants JOIN Organisations ON Grants.organisation_id = Organisations.organisation_id WHERE Organisations.organisation_details = ""research""",SELECT sum(grant_amount) FROM Grants AS T1 JOIN Organisations AS T2 ON T1.organisation_id  =  T2.organisation_id JOIN organisation_Types AS T3 ON T2.organisation_type  =  T3.organisation_type WHERE T3.organisation_type_description  =  'Research',tianyi,f233f6ea-12e9-4bd3-8cbd-5806b807d8ef,"D1a, CE2",zhengning,6688c879-5a39-42a5-8c7d-0f729abac42b,"D1a, CE2"
583,583,2027,What is the total amount of grant money for research?,SELECT SUM(Grants.grant_amount) FROM Grants,SELECT sum(grant_amount) FROM Grants AS T1 JOIN Organisations AS T2 ON T1.organisation_id  =  T2.organisation_id JOIN organisation_Types AS T3 ON T2.organisation_type  =  T3.organisation_type WHERE T3.organisation_type_description  =  'Research',tianyi,e54ef227-ae98-413f-b1e9-6f0e06331c23,"F4, CE2",zhengning,2987c1dc-e30d-451f-b974-25251cb424a1,"F4, CE2"
584,584,2028,List the project details of the projects which did not hire any staff for a researcher role.,SELECT Projects.project_details FROM Projects WHERE Projects.project_id NOT IN (SELECT Project_Staff.project_id FROM Project_Staff),SELECT project_details FROM Projects WHERE project_id NOT IN ( SELECT project_id FROM Project_Staff WHERE role_code  =  'researcher' ),tianyi,afe468da-1dfe-4be2-abf9-91fc9399f77c,F4,zhengning,2dc24f06-1dd1-4c6e-8530-e2a0ba2639f1,F4
