,Unnamed: 0,sql_id,nl_query,sql,GT_sql,tianyi,record_id_x,tianyi_code,zhengn,record_id_y,zhengn_code
0,0,1402,What are the last names for all scholarship students?,SELECT Student.LName FROM Student,SELECT T2.Lname FROM Sportsinfo AS T1 JOIN Student AS T2 ON T1.StuID  =  T2.StuID WHERE T1.onscholarship  =  'Y',tianyi,bb3cf31a-c06c-4d91-aa9f-e0f019acf128,"CE2, E1, BL3",zhengning,a86a3e76-6b36-4a20-87f2-7a89030a75b5,"F4, CE2"
1,1,1191,Find the name of persons who are friends with Bob.,"SELECT PersonFriend.name FROM Person JOIN PersonFriend ON Person.name = PersonFriend.friend WHERE PersonFriend.name = ""Bob""",SELECT T1.name FROM Person AS T1 JOIN PersonFriend AS T2 ON T1.name  =  T2.name WHERE T2.friend  =  'Bob',tianyi,96274f6f-0a3c-4e16-bcba-a37b7f3d4d5f,"E1, F4, BF4, CE2, Q1",zhengning,8f230d82-e7d9-45a5-9d67-407a5f01debd,"CE2, BE5, F4"
2,2,283,"What is the location of the club named ""Tennis Club""?","SELECT Club.ClubLocation FROM Club WHERE Club.ClubName = ""Tennis club""","SELECT clublocation FROM club WHERE clubname  =  ""Tennis Club""",tianyi,e74f9965-b219-4bf8-9782-bd0eaf1c2608,"BF4, D1a",zhengning,70000d84-bcee-4afe-b8f4-687636e768f3,"BE5, D1a"
3,3,1168,What roles did staff members play between '2003-04-19 15:06:20' and '2016-03-15 00:33:18'?,"SELECT Project_Staff.role_code FROM Project_Staff WHERE Project_Staff.date_from > ""2003-04 03-15 00 : 33 : 18"" AND Project_Staff.role_code = ""2016-04 03-15 00 : 33 : 18""",SELECT role_code FROM Project_Staff WHERE date_from  >  '2003-04-19 15:06:20' AND date_to  <  '2016-03-15 00:33:18',tianyi,db2a8277-72f4-4639-8f7b-de1263edb88c,"D1, BF4, D1a",zhengning,10787849-3ca2-408f-92e0-e11f1f9a8707,"D1, F1, D1a"
4,4,583,What is the average miles per gallon(mpg) of the cars with 4 cylinders?,SELECT AVG(cars_data.Horsepower) FROM cars_data WHERE cars_data.Cylinders = 4,SELECT avg(mpg) FROM CARS_DATA WHERE Cylinders  =  4;,tianyi,8cbe0095-6d8d-4c3f-9023-2ca957fb3d50,"BL1, D1, BF4",zhengning,114a06c5-64b3-40ee-a584-d209eaeeab29,"BL1, D1, F1"
5,5,1281,"What are the names of all the players who received a yes during tryouts, and also what are the names of their colleges?","SELECT Player.pName, Tryout.cName FROM Player JOIN Tryout ON Player.pID = Tryout.pID JOIN College ON Tryout.pID = College.cName WHERE Player.yCard = ""yes""","SELECT T1.pName ,  T2.cName FROM player AS T1 JOIN tryout AS T2 ON T1.pID  =  T2.pID WHERE T2.decision  =  'yes'",tianyi,c854d68b-3b53-4364-b3bb-14d55b90b043,"CE3, BL1, E1, BF4",zhengning,32d9c8f0-8650-48a5-9fa0-52ff813bb62d,"BL1, E1"
6,6,669,What are the names of tracks that contain the the word you in them?,"SELECT Track.Name FROM Track WHERE Track.Name LIKE ""% you %""",SELECT Name FROM TRACK WHERE Name LIKE '%you%',tianyi,be4f2003-f673-497f-8966-de9ef5a87970,"CE3, D1c, E1, BF4",zhengning,1e338347-c47d-49cc-bcc2-dead64bfb374,"D1, E1"
7,7,107,Find the number of schools that have more than one donator whose donation amount is less than 8.5.,"SELECT COUNT(*), endowment.School_id FROM endowment WHERE endowment.amount > 8.5 GROUP BY endowment.School_id HAVING COUNT(*) > 1",SELECT count(*) FROM (SELECT * FROM endowment WHERE amount  >  8.5 GROUP BY school_id HAVING count(*)  >  1),tianyi,2f096104-988d-4579-9d3c-f892791e5892,"D1c, BL2",zhengning,02b6fed7-b951-468f-b1dc-6c44943e0b39,"D1, BL2"
8,8,1022,Please show the names and the players of clubs.,"SELECT club.name, player.name FROM club JOIN player ON club.Club_ID = player.Club_ID","SELECT T1.name ,  T2.Player_id FROM club AS T1 JOIN player AS T2 ON T1.Club_ID  =  T2.Club_ID",tianyi,4eb1869c-1863-419d-b092-97dd65d9a915,"BL1, BL2",zhengning,22614383-6de6-45a0-9dda-3ffa95f225f6,
9,9,1065,"What is the id, genre, and name of the artist for every English song ordered by ascending rating?","SELECT song.song_name, song.genre_is, artist.artist_name FROM artist JOIN song ON artist.artist_name = song.f_id WHERE song.languages = ""English"" ORDER BY song.rating","SELECT f_id ,  genre_is ,  artist_name FROM song WHERE languages  =   ""english"" ORDER BY rating",tianyi,8331dd62-cd21-43de-b20b-b218fe44790b,"E1, D1a",zhengning,176248ea-660f-4552-bee2-b5c053931b73,"CL1, BL2, D1a"
10,10,680,"How many customers have email that contains ""gmail.com""?","SELECT COUNT(*) FROM Customer WHERE Customer.Email LIKE ""% gmail.com %""","SELECT COUNT(*) FROM CUSTOMER WHERE Email LIKE ""%gmail.com%""",tianyi,d4bae678-117f-4e5b-a25e-972fbeac0a57,"BL1, D1c, E1, D1a",zhengning,3383a84c-dfb4-465e-aa09-73b0563afb89,"CL1, D1, D1a"
11,11,623,"What is Weekly Rank of TV series with Episode ""A Love of a Lifetime""?","SELECT TV_series.Weekly_Rank FROM TV_series WHERE TV_series.Episode = ""A Love of A Lifetime""","SELECT Weekly_Rank FROM TV_series WHERE Episode = ""A Love of a Lifetime"";",tianyi,9e76a406-f648-426b-bde4-b598c2abbe12,"D1c, D1a",zhengning,1ee1a42f-0cc2-4b04-97b3-28077d66284c,"D1, D1a"
12,12,1237,What are the department name and room for the course INTRODUCTION TO COMPUTER SCIENCE?,"SELECT Department.DName, Department.Room FROM Course JOIN Department ON Department.DNO = Course.DNO WHERE Course.CName = ""COMPUTER SCIENCE""","SELECT T2.Dname ,  T2.Room FROM COURSE AS T1 JOIN DEPARTMENT AS T2 ON T1.DNO  =  T2.DNO WHERE T1.CName  =  ""INTRODUCTION TO COMPUTER SCIENCE""",tianyi,29dfb67e-ee7f-48cd-b432-79e5ed30f132,"D1c, D1a",zhengning,a9a8f4de-1674-43b7-ab48-a0c079cf347e,"D1, D1a"
13,13,1206,Show the names of members and the locations of colleges they go to in ascending alphabetical order of member names.,"SELECT member.Name, college.College_Location FROM member JOIN college ON member.College_ID = college.College_ID ORDER BY college.Name ASC","SELECT T2.Name ,  T1.College_Location FROM college AS T1 JOIN member AS T2 ON T1.College_ID  =  T2.College_ID ORDER BY T2.Name ASC",tianyi,62c485d4-09d4-48d2-91a1-21ed333cb770,"D1c, K3",zhengning,8b6a6a52-d0cb-4551-a228-cbe40a2eff87,D1
14,14,1227,"What are the last names of female students, ordered by age descending?","SELECT Student.LName FROM Student WHERE Student.Sex = ""VALUE"" ORDER BY Student.Age DESC","SELECT LName FROM STUDENT WHERE Sex  =  ""F"" ORDER BY Age DESC",tianyi,c2cb79e2-2ce5-4e6e-850b-11e85c87f6f1,"D1, K3",zhengning,2397e958-5b7b-4b5c-93ce-de4f31561fa5,D1
15,15,1044,What is the average rating of songs produced by female artists?,"SELECT AVG(song.rating) FROM artist JOIN song ON artist.artist_name = song.artist_name WHERE artist.gender = ""VALUE""","SELECT avg(T2.rating) FROM artist AS T1 JOIN song AS T2 ON T1.artist_name  =  T2.artist_name WHERE T1.gender  =  ""Female""",tianyi,8aaa0a0e-2cbb-409d-a0f2-c423241706dc,,zhengning,97fa7563-23d2-4d3e-b0f7-5b1003204a2c,
16,16,1007,How many engineers did each staff contact? List both the contact staff name and number of engineers contacted.,"SELECT Staff.staff_name, COUNT(*) FROM Staff JOIN Engineer_Visits ON Staff.staff_id = Engineer_Visits.contact_staff_id GROUP BY Engineer_Visits.contact_staff_id","SELECT T1.staff_name ,  count(*) FROM Staff AS T1 JOIN Engineer_Visits AS T2 ON T1.staff_id  =  T2.contact_staff_id GROUP BY T1.staff_name",tianyi,23fdae8c-8158-480c-ae60-84fb0604e211,"D1, BN1, Q1",zhengning,32eb0c58-ad1c-47d0-9c2a-2d9e5a3120d1,"D1, BN1"
17,17,726,Show the enrollment and primary_conference of the oldest college.,"SELECT university.Affiliation, university.Primary_conference FROM university ORDER BY university.Enrollment DESC LIMIT 1","SELECT enrollment ,  primary_conference FROM university ORDER BY founded LIMIT 1",tianyi,dd0f6403-87c0-46ef-981f-6e9b9d9a9968,"BL1, K3, BN1, K2",zhengning,34e12a32-a9ab-41cf-b980-dc807517768d,"BL1, BN1"
18,18,734,Find how many school locations have the word 'NY'.,"SELECT COUNT(university.Location) FROM university WHERE university.Location LIKE ""% NY %""","SELECT count(*) FROM university WHERE LOCATION LIKE ""%NY%""",tianyi,85355a99-60b6-4ec4-87d2-d148376706a1,"BL1, D1c, K2, K3",zhengning,719b60df-fef1-46ca-b697-49948d8a49b6,
19,19,772,"What are the ids, names, dates of opening, and other details for accounts corresponding to the customer with the first name ""Meaghan""?","SELECT Accounts.account_id, Accounts.date_account_opened, Accounts.other_account_details FROM Customers JOIN Accounts ON Customers.customer_id = Accounts.customer_id WHERE Customers.customer_first_name = ""Meaghan""","SELECT T1.account_id ,  T1.date_account_opened ,  T1.account_name ,  T1.other_account_details FROM Accounts AS T1 JOIN Customers AS T2 ON T1.customer_id  =  T2.customer_id WHERE T2.customer_first_name  =  'Meaghan'",tianyi,ed2ea0e7-339f-4aef-acdc-2fd5650901ea,"D1c, BL2",zhengning,3af50c2b-755a-4beb-8506-0b697fc81bda,"BL1, BL3"
20,20,816,What is the total balance of savings accounts not belonging to someone with the name Brown?,SELECT * FROM ACCOUNTS,SELECT sum(T2.balance) FROM accounts AS T1 JOIN savings AS T2 ON T1.custid  =  T2.custid WHERE T1.name != 'Brown',tianyi,39129c25-0d31-465e-b3d1-f3348f8fd8b1,"L5, CE2, F4, BL3",zhengning,902a89bc-af26-4cdc-ae0b-9ebd4f771bdf,"L5, CE2, F4, BL3"
21,21,1358,What is the first name of the students who are in age 20 to 25 and living in PHL city?,"SELECT Student.Fname FROM Student WHERE Student.Age BETWEEN 20 AND Student.city_code = ""PHL""",SELECT fname FROM student WHERE city_code  =  'PHL' AND age BETWEEN 20 AND 25,tianyi,34504598-6e4f-4172-8216-53af703865ed,"L5, CE2",zhengning,d33d93cc-bf43-4f9b-aff8-42297c20d981,"L5, CE2"
22,22,441,What are the different dorm amenity names in alphabetical order?,SELECT DISTINCT Dorm.dorm_name FROM Dorm JOIN Dorm_amenity ON Dorm.dormid = Dorm_amenity.amenid ORDER BY Dorm_amenity.amenity_name,SELECT amenity_name FROM dorm_amenity ORDER BY amenity_name,tianyi,0008dd00-658a-455f-b458-11596fdca3c4,"BL1, E1, A2a, BF4",zhengning,8aa71827-d346-482d-8d35-548361cdca02,"E1, A2a, F4"
23,23,611,"How many cartoons were written by ""Joseph Kuhr""?","SELECT COUNT(DISTINCT Cartoon.Written_by) FROM Cartoon WHERE Cartoon.Written_by = ""Joseph Kuhr""","SELECT count(*) FROM Cartoon WHERE Written_by = ""Joseph Kuhr"";",tianyi,c9981777-f006-431e-96e2-24a371ea11e3,"BL1, E1",zhengning,94122856-2320-4995-8b95-4362970ad008,"E1, BL2"
24,24,1361,Find the average and total capacity of dorms for the students with gender X.,"SELECT AVG(Dorm.student_capacity), SUM(Dorm.student_capacity) FROM Dorm JOIN Student ON Dorm.dormid = Student.StuID WHERE Student.Sex = ""X""","SELECT avg(student_capacity) ,  sum(student_capacity) FROM dorm WHERE gender  =  'X'",tianyi,92607d7d-34ff-4838-8604-a45373f75b70,"E1, A2a",zhengning,7c67c8ed-2dcc-48b2-b373-174df07a8d1d,"E1, A2a, CF5, BL2"
25,25,638,Find the names and publication dates of all catalogs that have catalog level number greater than 5.,"SELECT Catalogs.catalog_name, Catalogs.date_of_publication FROM Catalogs JOIN Catalog_Structure ON Catalogs.catalog_id = Catalog_Structure.catalog_id WHERE Catalog_Structure.catalog_level_name > 5","SELECT t1.catalog_name ,  t1.date_of_publication FROM catalogs AS t1 JOIN catalog_structure AS t2 ON t1.catalog_id  =  t2.catalog_id WHERE catalog_level_number  >  5",tianyi,e9e2cc02-d7f6-4f21-85be-9675363cdcde,"E1, Q1",zhengning,04bffa24-ddfd-426e-8d9c-752e88f0a980,
26,26,1111,What are the names of the ships  that are from either the US or the UK?,"SELECT ship.Name FROM ship WHERE ship.Nationality = ""US"" OR ship.Nationality = ""UK""","SELECT Name FROM ship WHERE Nationality  =  ""United States"" OR Nationality  =  ""United Kingdom""",tianyi,531292c3-a994-4dce-bc42-2ec2c2bc1cc2,D1c,zhengning,8d13b0da-afa2-404e-82c5-a62026da2af2,"D1c, E1, CF5"
27,27,975,"Find the name, account type, and account balance of the customer who has the highest credit score.","SELECT customer.cust_name, customer.acc_type, customer.acc_bal FROM customer ORDER BY customer.credit_score LIMIT 1","SELECT cust_name ,  acc_type ,  acc_bal FROM customer ORDER BY credit_score DESC LIMIT 1",tianyi,eadbbac7-6b73-4700-b150-085f4f35d4db,"D1c, K2",zhengning,e79564df-190b-4ee1-ab77-ffe7c520198b,"D1c, nan"
28,28,1150,What are the ids and details for all organizations that have grants of more than 6000 dollars?,"SELECT Grants.organisation_id, Organisations.organisation_details FROM Organisations JOIN Grants ON Organisations.organisation_id = Grants.organisation_id WHERE Grants.grant_amount > 6000","SELECT T2.organisation_id ,  T2.organisation_details FROM Grants AS T1 JOIN Organisations AS T2 ON T1.organisation_id  =  T2.organisation_id GROUP BY T2.organisation_id HAVING sum(T1.grant_amount)  >  6000",tianyi,38b02c9c-8f4e-4b85-b657-1ae48ef3899c,"F3, K2, A1f, AN2",zhengning,86fcea4a-5608-44ac-9bd7-2e5efdca5aab,"nan, A1f, AN2"
29,29,1354,"Show the customer name, customer address city, date from, and date to for each customer address history.","SELECT Customers.customer_name, Customer_Address_History.date_from, Customer_Address_History.date_to FROM Customers JOIN Customer_Address_History ON Customers.customer_id = Customer_Address_History.customer_id JOIN Addresses ON Customer_Address_History.address_id = Addresses.address_id","SELECT T2.customer_name ,  T3.city ,  T1.date_from ,  T1.date_to FROM customer_address_history AS T1 JOIN customers AS T2 ON T1.customer_id  =  T2.customer_id JOIN addresses AS T3 ON T1.address_id  =  T3.address_id",tianyi,501812fd-8c96-415a-8b58-ebe2c8002d93,"F3, A1f, BL3, AN2",zhengning,b538f9c0-e474-46eb-8124-11e8116a6b97,"A1f, BL3, AN2"
30,30,1292,Which college has any student who is a goalie and succeeded in the tryout.,"SELECT Tryout.cName FROM Tryout WHERE Tryout.pPos = ""goalie""",SELECT cName FROM  tryout WHERE decision  =  'yes' AND pPos  =  'goalie',tianyi,8eef175c-acb3-4bb0-8ded-6aa17fe4e7a7,"F4, BL3",zhengning,29aacc9c-294a-41c7-8bff-f2fe4318bc21,"F4, BL3"
31,31,193,What is the total number of customers who use banks in New York City?,"SELECT SUM(bank.no_of_customers) FROM bank WHERE bank.city = ""New York""",SELECT sum(no_of_customers) FROM bank WHERE city  =  'New York City',tianyi,67fb62be-9210-4f7e-8461-de9a2d124ad0,"D1c, F4",zhengning,01903dde-aae7-40fc-990c-fc888c51d9ca,"D1c, F4"
32,32,1090,Find the number of medications prescribed for each brand.,"SELECT Medication.Brand, COUNT(*) FROM Medication GROUP BY Medication.Brand","SELECT count(*) ,  T1.name FROM medication AS T1 JOIN prescribes AS T2 ON T1.code = T2.medication GROUP BY T1.brand",tianyi,91b7d4c5-7e22-426f-9b6e-c3191a2eb8ba,"D1c, BL1, CE2",zhengning,68ffb1ac-8ac4-4949-af2b-ed79b6d417db,"D1c, BL1, CE2"
33,33,942,Find the parties associated with the delegates from district 1. Who served as governors of the parties?,SELECT party.Party FROM party JOIN election ON party.Party_ID = election.Party WHERE election.District = 1,SELECT T2.Governor FROM election AS T1 JOIN party AS T2 ON T1.Party  =  T2.Party_ID WHERE T1.District  =  1,tianyi,e763944e-3949-4510-b140-7a061b0be522,CE2,zhengning,9a4b967a-fe6b-4890-98f4-369761a0b50e,"CE2, BF4"
34,34,1161,How many project staff worked as leaders or started working before '1989-04-24 23:51:54'?,"SELECT COUNT(*) FROM Project_Staff WHERE Project_Staff.date_from < ""1989-04-24 23 : 51 : 54"" OR Project_Staff.date_from < ""1989-04-24 23 : 51 : 54""",SELECT count(*) FROM Project_Staff WHERE role_code  =  'leader' OR date_from  <  '1989-04-24 23:51:54',tianyi,00e2c606-0986-4592-bcab-0ec9c242eeb0,"BL1, F3, F1, D1, BF4",zhengning,9ec86996-2859-451f-a903-27a3e4345ab2,"BL1, F3, BF4, F4"
35,35,1199,Who has a friend that is from new york city?,"SELECT Person.name FROM Person JOIN PersonFriend ON Person.name = PersonFriend.friend WHERE Person.city = ""new york""",SELECT T2.name FROM Person AS T1 JOIN PersonFriend AS T2 ON T1.name  =  T2.friend WHERE T1.city  =  'new york city',tianyi,837e0757-5767-4254-8983-8925e79e63b1,"F3, F1, D1, BF4, D1c",zhengning,9db7e60d-cec1-47a8-84cc-92da86ca17e8,"D1c, F3, F4"
36,36,1066,What is average salary of the players in the team named 'Boston Red Stockings' ?,"SELECT AVG(player_college.year) FROM player_college WHERE player_college.college_id = ""Boston Red Stockings""",SELECT avg(T1.salary) FROM salary AS T1 JOIN team AS T2 ON T1.team_id  =  T2.team_id_br WHERE T2.name  = 'Boston Red Stockings',tianyi,7668b866-9495-4e4b-810c-436fe011099c,"BL1, CE2, CF5, D1c, CL1, BF4",zhengning,a3254efd-0721-48e1-9356-a35a66ac5dbc,"CL1, D1c"
37,37,1151,"When do all the researcher role staff start to work, and when do they stop working?","SELECT Project_Staff.date_from, Project_Staff.date_to FROM Project_Staff","SELECT date_from ,  date_to FROM Project_Staff WHERE role_code  =  'researcher'",tianyi,b944c7e9-9a1c-4f21-8dc3-da841c585cb5,"BL1, F4, CL1, BF4, CE2, CF5",zhengning,f8266d13-5cfc-43ed-a42e-a7fe8a9c82bc,"CL1, F4"
38,38,899,What are the countries that have at least two perpetrators?,SELECT perpetrator.Country FROM perpetrator GROUP BY perpetrator.Country HAVING COUNT(*) >= 2,"SELECT Country ,  COUNT(*) FROM perpetrator GROUP BY Country HAVING COUNT(*)  >=  2",tianyi,2a72a61c-1478-4562-b9e2-b097a46725f2,"L5, F4, BL3",zhengning,abcd02d4-b5a9-4871-a243-ccfae12c1578,"L5, F4"
39,39,854,What are the payment date of the payment with amount paid higher than 300 or with payment type is 'Check',"SELECT Payments.payment_date FROM Payments WHERE Payments.amount_paid_in_full_yn > 300 OR Payments.payment_type_code = ""Check""",SELECT payment_date FROM payments WHERE amount_paid  >  300 OR payment_type_code  =  'Check',tianyi,281d128b-1040-43f7-840a-f72c5e1df77a,"L5, BF4, BL3",zhengning,2879ea40-030a-4be1-8d3f-eac984726a55,"L5, BF4"
40,40,780,"What are the the full names and ids for all customers, and how many accounts does each have?","SELECT Customers.customer_first_name, Customers.customer_middle_initial, COUNT(*), Customers.customer_id FROM Customers JOIN Accounts ON Customers.customer_id = Accounts.customer_id GROUP BY Customers.customer_id","SELECT T1.customer_id ,  T2.customer_first_name ,  T2.customer_last_name ,  count(*) FROM Accounts AS T1 JOIN Customers AS T2 ON T1.customer_id  =  T2.customer_id GROUP BY T1.customer_id",tianyi,183998ed-8238-4f95-b37b-79bf48bd5cb6,"BN1, BF4, BL3",zhengning,fb7c18ef-88a6-4f5e-947a-128a83890fc7,"CL1, BF4"
41,41,1290,Find the average hours for the students whose tryout decision is no.,"SELECT AVG(Tryout.decision) FROM Tryout WHERE Tryout.decision = ""no""",SELECT avg(T1.HS) FROM player AS T1 JOIN tryout AS T2 ON T1.pID  =  T2.pID WHERE T2.decision  =  'no',tianyi,20d357a7-e373-4053-8740-c995b5b59af6,"BL1, BL3, BN1, CL1, CE2",zhengning,7d6a238a-60e7-4891-a99c-0f1b2b1ceea0,"BL1, CE2"
42,42,1149,Find the organisation ids and details of the organisations which are involved in,"SELECT Organisations.organisation_id, Organisations.organisation_details FROM Organisations","SELECT T2.organisation_id ,  T2.organisation_details FROM Grants AS T1 JOIN Organisations AS T2 ON T1.organisation_id  =  T2.organisation_id GROUP BY T2.organisation_id HAVING sum(T1.grant_amount)  >  6000",tianyi,b58b3fc8-34cc-4e72-a217-bcfbad67642e,"BL1, AN2, CL1, A1f",zhengning,3940e4da-a33f-4660-8442-211f074fbf96,"CL1, A1f, AN2"
43,43,229,List the position of players with average number of points scored by players of that position bigger than 20.,SELECT player.Position FROM player GROUP BY player.Position HAVING AVG(player.Points) > 20,SELECT POSITION FROM player GROUP BY name HAVING avg(Points)  >=  20,tianyi,22aa1327-ac25-43c8-b979-0bfb381c18cf,"F1, AN2, BN1, CE2, A1f",zhengning,e64619d9-ec4f-4692-8f9e-595b08e4bd79,"CE2, BN1, A1f, AN2"
44,44,656,Find the name and capacity of products with price greater than 700 (in USD).,SELECT Catalog_Contents.capacity FROM Catalog_Contents WHERE Catalog_Contents.price_in_dollars > 700,"SELECT catalog_entry_name ,  capacity FROM Catalog_Contents WHERE price_in_dollars  >  700",tianyi,83ac7242-9953-413a-aaf2-a9428369d35b,"BN1, F1, BL3",zhengning,ee82c408-c4fa-4b64-8962-aa2be2715236,"BN1, BL3"
45,45,713,What are the names of enzymes that include the string 'ALA'?,"SELECT enzyme.name FROM enzyme WHERE enzyme.name LIKE ""% ALA %""","SELECT name FROM enzyme WHERE name LIKE ""%ALA%""",tianyi,f2a0c80a-9432-4b1b-8c1d-a072dd008d22,"D1c, BL3",zhengning,d61bf488-50f3-4d33-ae94-be16e687d242,"D1, BL3"
46,46,280,"Find the description of the club called ""Tennis Club"".","SELECT Club.ClubDesc FROM Club WHERE Club.ClubName = ""Tennis club""","SELECT clubdesc FROM club WHERE clubname  =  ""Tennis Club""",tianyi,a2bdc64b-8db1-4cdb-bbe5-408b148322ba,"D1c, D1a",zhengning,62ced6f2-0590-4ffc-8663-e43c1d30c0cb,"D1, D1a"
47,47,1069,List the first and last name for players who participated in all star game in 1998.,SELECT all_star.game_id FROM player_college JOIN all_star ON player_college.player_id = all_star.player_id WHERE all_star.year = 1998,"SELECT name_first ,  name_last FROM player AS T1 JOIN all_star AS T2 ON T1.player_id  =  T2.player_id WHERE YEAR  =  1998",tianyi,4cc671bb-21af-4ddc-a22c-7bd49e6f79be,"CE3, BL1, D1a",zhengning,19c1bcdd-cf48-4cf2-a26c-8156fe22a0b5,"CL1, D1a"
48,48,592,"In 1980, how many cars were made?",SELECT COUNT(*) FROM car_names WHERE car_names.Model = 1980,SELECT count(*) FROM CARS_DATA WHERE YEAR  =  1980;,tianyi,ae72f9d2-c060-4b1c-9013-41ed8c7c7b2c,"BL1, CE3, BF4",zhengning,4ed1c357-a71d-4119-9c96-9b62a6041b32,CF5
49,49,675,Count the number of tracks that are part of the rock genre.,"SELECT COUNT(*) FROM Genre JOIN Track ON Genre.GenreId = Track.GenreId WHERE Genre.Name = ""rock""","SELECT COUNT(*) FROM GENRE AS T1 JOIN TRACK AS T2 ON T1.GenreId  =  T2.GenreId WHERE T1.Name  =  ""Rock""",tianyi,96e0b367-9cc4-40c2-8ff5-455621eaae77,"BF4, D1a",zhengning,05de2468-f4f8-4f33-a18a-6cd59c38882d,"CF5, CL1, D1a"
50,50,967,Find the name and account balance of the customer whose name includes the letter ‘a’.,"SELECT customer.cust_name, customer.acc_bal FROM customer WHERE customer.cust_name LIKE ""% a %""","SELECT cust_name ,  acc_bal FROM customer WHERE cust_name LIKE '%a%'",tianyi,68e10111-3aef-423d-9ee6-552efde2e520,"D1c, D1a",zhengning,b7261b29-f9bc-4aee-9617-f48cbd27d987,"D1, D1a"
51,51,414,What are the different cities that have more than 100 memberships?,SELECT member.Hometown FROM member GROUP BY member.Hometown HAVING COUNT(*) > 100,SELECT DISTINCT city FROM branch WHERE membership_amount  >=  100,tianyi,47d7efdd-3780-4b6d-b166-d2e3f1aab9b3,"O2, BL1, D1c, N3, CL1",zhengning,7766d323-41ab-45d6-9167-1f741179b433,"BL3, D1"
52,52,668,"Find the names of all the tracks that contain the word ""you"".","SELECT Track.Name FROM Track WHERE Track.Name LIKE ""% you %""",SELECT Name FROM TRACK WHERE Name LIKE '%you%',tianyi,76cbfce7-2eeb-4511-a00c-4a8640f710d0,"BL1, N3, CL1, O2, D1c, A1b",zhengning,0c589d1f-b672-4bf6-b3f2-8d7fb6f0292c,BL3
53,53,649,"Which catalog contents have a product stock number that starts from ""2""? Show the catalog entry names.","SELECT Catalog_Contents.catalog_entry_name FROM Catalog_Contents WHERE Catalog_Contents.catalog_entry_name LIKE ""2 %""","SELECT catalog_entry_name FROM catalog_contents WHERE product_stock_number LIKE ""2%""",tianyi,c5a5c5a3-2af0-4ea3-917e-cd989c61c391,BF4,zhengning,2a5ed879-8b7b-43e4-a479-7162143a3f38,BF4
54,54,906,"What are the support, consider, and oppose rates of each candidate, ordered ascending by their unsure rate?","SELECT candidate.Support_rate, candidate.Oppose_rate FROM candidate ORDER BY candidate.Unsure_rate","SELECT Support_rate ,  Consider_rate ,  Oppose_rate FROM candidate ORDER BY unsure_rate",tianyi,9f7ba138-6247-4cb8-a136-bec456c7dd83,"D1c, BF4, BL3",zhengning,1a478c28-f3f5-41a8-a6da-0fa29578439e,"BF4, BL3"
55,55,698,What is the average unit price of rock tracks?,"SELECT AVG(Track.UnitPrice) FROM Genre JOIN Track ON Genre.GenreId = Track.GenreId WHERE Genre.Name = ""rock""","SELECT AVG(T2.UnitPrice) FROM GENRE AS T1 JOIN TRACK AS T2 ON T1.GenreId  =  T2.GenreId WHERE T1.Name  =  ""Rock""",tianyi,d512b16c-cd3d-49fd-8b60-ee1b52acc023,"BL3, D1a",zhengning,81b1bbb8-5c54-4e89-ace5-17a557c0a5c2,"BL3, D1a"
56,56,317,Find the person who has exactly one friend.,SELECT PersonFriend.friend FROM PersonFriend GROUP BY PersonFriend.name HAVING COUNT(*) = 1,SELECT name FROM PersonFriend GROUP BY name HAVING count(*)  =  1,tianyi,b7c3cb6b-37d3-487c-8d7a-6f97391d79b3,"BL1, D1a",zhengning,384a552f-f01d-4c86-89fb-bdaaaf75083f,"BL1, D1a"
57,57,757,Show the names of people and the number of times they have been on the affirmative side of debates.,"SELECT people.Name, COUNT(*) FROM debate_people JOIN people ON debate_people.Affirmative = people.People_ID WHERE debate_people.Affirmative = affirmative GROUP BY debate_people.Affirmative","SELECT T2.Name ,  COUNT(*) FROM debate_people AS T1 JOIN people AS T2 ON T1.Affirmative  =  T2.People_ID GROUP BY T2.Name",tianyi,d0cedc0f-81e6-4a4b-83b9-b615324f1224,"BL1, BN1, F4",zhengning,387cec02-8f55-46f0-bdf1-230a9e2d6c2b,"BL1, F3, BN1"
58,58,761,Find the total and average amount paid in claim headers.,"SELECT SUM(Claim_Headers.Amount_Claimed), AVG(Claim_Headers.Amount_Claimed) FROM Claim_Headers","SELECT sum(amount_piad) ,  avg(amount_piad) FROM claim_headers",tianyi,47019a0e-9a93-45e2-9bcd-cc689c815184,"BL1, BN1, F4",zhengning,0989b2b6-2024-4f9e-8126-12d6f636befe,"BL1, BN1, F3"
59,59,851,"What are the first name, last name, and gender of all the good customers? Order by their last name.","SELECT Customers.first_name, Customers.last_name, Customers.gender_mf FROM Customers ORDER BY Customers.good_or_bad_customer","SELECT first_name ,  last_name ,  gender_mf FROM customers WHERE good_or_bad_customer  =  'good' ORDER BY last_name",tianyi,c67779f3-a5b4-488d-9e1b-b38fc52fdbfd,"BL1, K3, F4",zhengning,da13943a-04fd-4af8-b807-8fd0ab792f3e,"BL1, F4"
60,60,1059,What are the names of all male British artists?,"SELECT artist.artist_name FROM artist WHERE artist.gender = ""British""","SELECT artist_name FROM artist WHERE country  =  ""UK"" AND gender  =  ""Male""",tianyi,1e9ba39c-fcf4-4901-ae2f-f135cfc1cdf7,"D1c, K3",zhengning,fb7411da-9e5f-4882-8909-da0820d1422c,D1
