,Unnamed: 0,sql_id,nl_query,sql,GT_sql,tianyi,record_id_x,tianyi_code,zhengn,record_id_y,zhengn_code
381,381,1611,"What is the average, minimum, and maximum age of all singers from France?","SELECT AVG(singer.Age), MIN(singer.Age) FROM singer WHERE singer.Country = ""France""","SELECT avg(age) ,  min(age) ,  max(age) FROM singer WHERE country  =  'France'",tianyi,fd1613d4-5b3a-4b41-9aa3-3ad17813e36b,BL3,zhengning,bbdbfe85-ceec-4af1-b894-e924c324a654,"BK1, CE2, A1d, P3, BF4, A2c, F2, A2b, L5, KA1b, AN2, L4, CE3, O1, BL3, F1"
382,382,1612,"What is the average, minimum, and maximum age for all French singers?","SELECT AVG(singer.Age), MIN(singer.Age), MAX(singer.Age) FROM singer WHERE singer.Country = ""VALUE""","SELECT avg(age) ,  min(age) ,  max(age) FROM singer WHERE country  =  'France'",tianyi,ed6ebbb1-235d-42fd-b64b-fcc79e5fa20d,D1,zhengning,0bc61a76-634d-467a-9b2f-1bee44572aec,D1
383,383,1619,What is the maximum capacity and the average of all stadiums ?,"SELECT MAX(stadium.Capacity), AVG(stadium.Average) FROM stadium","select max(capacity), average from stadium",tianyi,44c95626-2324-4594-bd9a-48f45dbd7bf3,L4,zhengning,55297090-cfd3-472f-b837-fef9a9ddb05c,"E1, BK1, CE2, A1d, P3, BL2, CL1, BF4, A2c, F2, A2b, L5, KA1b, AN2, D1, CE3, I2, O1, BL3, F4"
384,384,1620,What is the average and maximum capacities for all stadiums ?,"SELECT AVG(stadium.Average), MAX(stadium.Capacity) FROM stadium","select avg(capacity) ,  max(capacity) from stadium",tianyi,ffb2e2f3-7176-4d87-857b-278276bd75bc,BL1,zhengning,e3a8bb67-c9ef-4888-aa04-a9e28e4d26cb,"E1, BK1, CE2, CL1, A1d, P3, BL2, BF4, A2c, F2, A2b, L5, KA1b, AN2, D1, CE3, I2, O1, BL3, F4"
385,385,1628,"What are the names , themes , and number of singers for every concert ?","SELECT concert.concert_Name, concert.Theme, COUNT(*) FROM concert JOIN singer_in_concert ON concert.concert_ID = singer_in_concert.concert_ID JOIN singer ON singer_in_concert.Singer_ID = singer.Singer_ID GROUP BY singer.Name","select t2.concert_name ,  t2.theme ,  count(*) from singer_in_concert as t1 join concert as t2 on t1.concert_id  =  t2.concert_id group by t2.concert_id",tianyi,b59300c0-d62d-4308-a403-13e8b3bea31a,"E1, BN1",zhengning,c2f6d27b-f8e1-4018-92b8-09cb67ee5d2c,"BK1, BL3, CE2, CL1, A1d, P3, BL2, BF4, A2c, F2, A2b, L5, BE5, KA1b, AN2, D1, BN1, CE3, I2, O1, BL3, F4"
386,386,1629,List singer names and number of concerts for each singer.,"SELECT singer.Name, COUNT(*) FROM singer JOIN singer_in_concert ON singer.Singer_ID = singer_in_concert.Singer_ID GROUP BY singer.Name","SELECT T2.name ,  count(*) FROM singer_in_concert AS T1 JOIN singer AS T2 ON T1.singer_id  =  T2.singer_id GROUP BY T2.singer_id",tianyi,255c9a4f-4331-4dbf-8963-db7868163f1f,BN1,zhengning,a8751ff3-47aa-49af-9f85-b8dafb5435dc,"BK1, BL3, A1d, P3, BL2, CL1, BF4, A2c, F2, A2b, L5, BL1, K3, BE5, KA1b, AN2, D1, CE3, I2, O1, BL3, N3, F4"
387,387,1630,What are the names of the singers and number of concerts for each person?,"SELECT singer.Name, COUNT(*) FROM singer JOIN singer_in_concert ON singer.Singer_ID = singer_in_concert.Singer_ID GROUP BY singer.Name","SELECT T2.name ,  count(*) FROM singer_in_concert AS T1 JOIN singer AS T2 ON T1.singer_id  =  T2.singer_id GROUP BY T2.singer_id",tianyi,6fb92817-d508-497c-b73d-8f9b451158f5,BN1,zhengning,83bed1be-994a-48b3-9f0e-e65a1e9f18e6,"BN1, CL1"
388,388,1631,what is the name and nation of the singer who have a song having 'Hey' in its name?,"SELECT singer.Name, singer.Country FROM singer JOIN singer_in_concert ON singer.Singer_ID = singer_in_concert.Singer_ID WHERE singer.Song_Name LIKE ""% Hey %""","SELECT name ,  country FROM singer WHERE song_name LIKE '%Hey%'",tianyi,013b5aa0-a97b-4974-b964-87ce8dffab57,"E1, D1c",zhengning,a007f2ef-d3ef-46ca-b7b3-f0fbbbc4ac4f,"E1, BK1, CL1, A1d, P3, BL2, BF4, A2c, F2, A2b, L5, BL1, K3, KA1b, AN2, BN1, I2, O1, BL3, N3, F4"
389,389,1632,What is the name and country of origin of every singer who has a song with the word 'Hey' in its title?,"SELECT singer.Name, singer.Country FROM singer WHERE singer.Song_Name LIKE ""% Hey %""","SELECT name ,  country FROM singer WHERE song_name LIKE '%Hey%'",tianyi,0614ec5f-a339-444a-a6d0-f8b396698978,D1c,zhengning,56985579-c31f-4fb4-b41f-bbff2e80665e,D1
390,390,1634,"For each continent, list its id, name, and how many countries it has?","SELECT continents.Continent, countries.CountryName, COUNT(*) FROM continents JOIN countries ON continents.ContId = countries.Continent GROUP BY continents.Continent","SELECT T1.ContId ,  T1.Continent ,  count(*) FROM CONTINENTS AS T1 JOIN COUNTRIES AS T2 ON T1.ContId  =  T2.Continent GROUP BY T1.ContId;",tianyi,89340a28-9ccf-475e-b561-902d031cf8e8,"BL1, BN1",zhengning,c883e46f-f13f-4782-a080-7234fe560a7c,"BL1, BN1"
391,391,1635,"How many models does each car maker produce? List maker full name, id and the number.","SELECT car_makers.FullName, car_makers.Maker, COUNT(*) FROM car_makers JOIN model_list ON car_makers.Id = model_list.Maker GROUP BY car_makers.Maker","SELECT T1.FullName ,  T1.Id ,  count(*) FROM CAR_MAKERS AS T1 JOIN MODEL_LIST AS T2 ON T1.Id  =  T2.Maker GROUP BY T1.Id;",tianyi,33bbeb30-bd35-4413-928f-df2da4435545,"BL1, BN1",zhengning,a4f06cb3-ddc1-4690-b8f4-9f0804b40530,"BL1, BN1"
392,392,1637,How many car models are produced by each maker ? Only list the count and the maker full name .,"SELECT COUNT(*), car_makers.Maker FROM car_makers JOIN model_list ON car_makers.Id = model_list.Maker GROUP BY car_makers.Maker","select count(*) ,  t2.fullname from model_list as t1 join car_makers as t2 on t1.maker  =  t2.id group by t2.id;",tianyi,4a146a36-8be5-4b38-b7eb-cab2ff042d87,"BL1, BN1",zhengning,dcd31c35-7b5c-4934-9691-4cb47d57d00d,"CL1, BL1"
393,393,1638,What is the number of car models that are produced by each maker and what is the id and full name of each maker?,"SELECT car_makers.Id, car_makers.FullName, COUNT(*) FROM car_makers JOIN car_names ON car_makers.Id = car_names.MakeId GROUP BY car_makers.Id","SELECT Count(*) ,  T2.FullName ,  T2.id FROM MODEL_LIST AS T1 JOIN CAR_MAKERS AS T2 ON T1.Maker  =  T2.Id GROUP BY T2.id;",tianyi,578e9f67-d517-42e0-84cc-a0224c9e85af,"BE5, CE3",zhengning,ae88649a-799a-461a-ae7f-a05ae7c02b51,"CL1, BE5"
394,394,1639,What is the accelerate of the car make amc hornet sportabout (sw)?,"SELECT cars_data.Accelerate FROM car_names JOIN cars_data ON car_names.MakeId = cars_data.Id WHERE car_names.Make = ""amc hornet sportabout (sw""",SELECT T1.Accelerate FROM CARS_DATA AS T1 JOIN CAR_NAMES AS T2 ON T1.Id  =  T2.MakeId WHERE T2.Make  =  'amc hornet sportabout (sw)';,tianyi,fc134fdb-136a-4ba6-bf0c-44fd90da9d58,D1c,zhengning,a40e3d19-ef3b-45ae-a81d-114a52d1f8dd,"CL1, D1"
395,395,1640,How much does the car accelerate that makes amc hornet sportabout (sw)?,"SELECT cars_data.Accelerate FROM car_names JOIN cars_data ON car_names.MakeId = cars_data.Accelerate WHERE car_names.Make = ""amc hornet sportaboutout"" AND car_names.Make = ""sw""",SELECT T1.Accelerate FROM CARS_DATA AS T1 JOIN CAR_NAMES AS T2 ON T1.Id  =  T2.MakeId WHERE T2.Make  =  'amc hornet sportabout (sw)';,tianyi,6ef9ff32-cd28-4f5b-b5da-f0fb9c8aeacf,"BE5, D1",zhengning,18bdb0bd-8063-4b11-95dd-6565779c7c9a,"D1, BE5, F2"
396,396,1642,What is the number of makers of care in France?,"SELECT COUNT(*) FROM countries JOIN car_makers ON countries.CountryId = car_makers.Country WHERE countries.CountryName = ""France""",SELECT count(*) FROM CAR_MAKERS AS T1 JOIN COUNTRIES AS T2 ON T1.Country  =  T2.CountryId WHERE T2.CountryName  =  'france';,tianyi,e9deceeb-2437-4969-b970-e5d3ca7f81bc,D1a,zhengning,475d4312-d539-42b3-90ac-490e60de99c5,"CL1, D1a"
397,397,1643,What is the smallest weight of the car produced with 8 cylinders on 1974 ?,SELECT MIN(cars_data.Weight) FROM cars_data WHERE cars_data.Cylinders = 1974 AND cars_data.Year = 8,select min(weight) from cars_data where cylinders  =  8 and year  =  1974,tianyi,580fb806-8ed7-48b4-8827-bc9f78cf82f8,D1,zhengning,45133599-baeb-4b67-96d7-34370e493c80,D1
398,398,1644,What is the minimum weight of the car with 8 cylinders produced in 1974 ?,SELECT MIN(cars_data.Weight) FROM cars_data WHERE cars_data.Year = 1974 AND cars_data.Year = 8,select min(weight) from cars_data where cylinders  =  8 and year  =  1974,tianyi,ae57db4a-1cca-43ba-8aed-009f98cc45ec,BF4,zhengning,d570aa05-a6b3-4731-aa12-ddb4be53806f,D1
399,399,1645,What are all the makers and models?,"SELECT car_makers.Maker, model_list.Model FROM car_makers JOIN model_list ON car_makers.Id = model_list.Maker","SELECT Maker ,  Model FROM MODEL_LIST;",tianyi,294e12db-74e9-4bc0-909b-4fc28de2383a,"E1, CL1",zhengning,64a1a3bf-f385-4eb3-a2d5-65cbd2404da2,"E1, CL1"
400,400,1646,What are the makers and models?,"SELECT car_makers.Maker, model_list.Model FROM car_makers JOIN model_list ON car_makers.Id = model_list.Maker","SELECT Maker ,  Model FROM MODEL_LIST;",tianyi,960c467b-9e03-405a-b175-bda70aee3814,"E1, CL1",zhengning,94f50634-337c-4cb6-8e9a-3ea930498834,"E1, CL1"
401,401,1647,What are the countries having at least one car maker? List name and id.,"SELECT countries.CountryName, countries.CountryId FROM countries JOIN car_makers ON countries.CountryId = car_makers.Country","SELECT T1.CountryName ,  T1.CountryId FROM COUNTRIES AS T1 JOIN CAR_MAKERS AS T2 ON T1.CountryId  =  T2.Country GROUP BY T1.CountryId HAVING count(*)  >=  1;",tianyi,044ef3ec-5831-484f-be6e-698acbc2f6a1,"AN2, A1f",zhengning,45361ba9-1abf-4ee5-81d7-9c5c72f3fc29,AN2
402,402,1648,What are the names and ids of all countries with at least one car maker?,"SELECT countries.CountryName, countries.CountryId FROM countries JOIN car_makers ON countries.CountryId = car_makers.Country","SELECT T1.CountryName ,  T1.CountryId FROM COUNTRIES AS T1 JOIN CAR_MAKERS AS T2 ON T1.CountryId  =  T2.Country GROUP BY T1.CountryId HAVING count(*)  >=  1;",tianyi,1943e2a6-1ed1-4d14-9d6b-28e658580fc5,"AN2, A1f",zhengning,ff5c5f98-9908-42cf-8b22-206916140326,AN2
403,403,1651,What is the average edispl of the cars of model volvo?,"SELECT AVG(cars_data.Edispl) FROM model_list JOIN cars_data ON cars_data.Id = model_list.Maker WHERE model_list.Model = ""volvo""",SELECT avg(T2.edispl) FROM CAR_NAMES AS T1 JOIN CARS_DATA AS T2 ON T1.MakeId  =  T2.Id WHERE T1.Model  =  'volvo';,tianyi,9044d49c-4698-4b6e-a2c0-59ac678d8e2d,"BE5, CF5, CE3",zhengning,c535d55d-e417-4d1a-bfd0-a35e53da46bc,"CL1, CE3"
404,404,1652,What is the average edispl for all volvos?,SELECT AVG(cars_data.Edispl) FROM cars_data,SELECT avg(T2.edispl) FROM CAR_NAMES AS T1 JOIN CARS_DATA AS T2 ON T1.MakeId  =  T2.Id WHERE T1.Model  =  'volvo';,tianyi,57958285-8b64-4b0e-9007-d13e39983c5c,"F4, CL1, CE2",zhengning,76215d39-f726-43cb-a58a-f5fb41e190e8,"CL1, CE2, F4"
405,405,1653,What is the maximum accelerate for different number of cylinders?,"SELECT MAX(cars_data.Accelerate), cars_data.Cylinders FROM cars_data GROUP BY cars_data.Accelerate","SELECT max(Accelerate) ,  Cylinders FROM CARS_DATA GROUP BY Cylinders;",tianyi,3e5c02f9-7b55-4f3a-b66a-d8e7d942cc86,BN1,zhengning,75d0023d-7334-4f35-8768-f2bd856fc248,BN1
406,406,1657,Which makers designed more than 3 car models? List full name and the id.,"SELECT car_makers.FullName, car_makers.Maker FROM car_makers JOIN model_list ON car_makers.Id = model_list.Maker GROUP BY car_makers.Id HAVING COUNT(*) > 3","SELECT T1.FullName ,  T1.Id FROM CAR_MAKERS AS T1 JOIN MODEL_LIST AS T2 ON T1.Id  =  T2.Maker GROUP BY T1.Id HAVING count(*)  >  3;",tianyi,d0fca1d6-fa3f-4182-81b3-54d5a579dc6c,BL1,zhengning,20450178-df0d-4d5a-985d-2f02234a4b00,BL1
407,407,1658,What are the names and ids of all makers with more than 3 models?,"SELECT car_makers.Maker, car_makers.Id FROM car_makers JOIN model_list ON car_makers.Id = model_list.Maker GROUP BY car_makers.Id HAVING COUNT(*) > 3","SELECT T1.FullName ,  T1.Id FROM CAR_MAKERS AS T1 JOIN MODEL_LIST AS T2 ON T1.Id  =  T2.Maker GROUP BY T1.Id HAVING count(*)  >  3;",tianyi,e66236a2-9130-4223-a4dd-7d612fa98041,BL1,zhengning,fc38e5b0-7e67-46f5-b5ab-406ed9b84409,BL1
408,408,1661,How many countries has more than 2 car makers ?,SELECT COUNT(car_makers.Country) FROM countries JOIN car_makers ON countries.CountryId = car_makers.Country GROUP BY car_makers.Country HAVING COUNT(*) > 2,select count(*) from countries as t1 join car_makers as t2 on t1.countryid  =  t2.country group by t1.countryid having count(*)  >  2,tianyi,5e2a40e6-f49e-4898-97a7-d56a5cfb713d,BN1,zhengning,b3a24ecd-ade2-4c44-8b54-e07724268d46,"BL1, BN1"
409,409,1662,What is the number of countries with more than 2 car makers ?,SELECT COUNT(car_makers.Country) FROM countries JOIN car_makers ON countries.CountryId = car_makers.Country GROUP BY car_makers.Country HAVING COUNT(*) > 2,select count(*) from countries as t1 join car_makers as t2 on t1.countryid  =  t2.country group by t1.countryid having count(*)  >  2,tianyi,80acbc9f-072f-4066-9802-65267c3dc06b,CL1,zhengning,4eafd752-eb7d-4a9f-a417-0ebc6d450cac,"BL1, BN1"
410,410,1663,What is the maximum miles per gallon of the car with 8 cylinders or produced before 1980 ?,SELECT MAX(cars_data.Horsepower) FROM cars_data WHERE cars_data.Year < 1980 OR cars_data.Year < 1980,select max(mpg) from cars_data where cylinders  =  8 or year  <  1980,tianyi,39f340af-7a9d-4b9b-9480-537bd86948fb,"BL1, F4",zhengning,6807a555-907c-4abf-944f-44d6bb8861bf,"F3, BL1, F4"
411,411,1667,Which cities do more than one employee under age 30 come from?,SELECT employee.City FROM employee WHERE employee.Age > 30 GROUP BY employee.City HAVING COUNT(*) > 1,SELECT city FROM employee WHERE age  <  30 GROUP BY city HAVING count(*)  >  1,tianyi,76b02e46-5d18-4084-95f5-4a1511a15cfb,F1,zhengning,744c65f3-d411-4d73-a0ea-737189b42281,"N3, F1"
412,412,1668,Find the cities that have more than one employee under age 30.,SELECT employee.City FROM employee WHERE employee.Age > 30 GROUP BY employee.City HAVING COUNT(*) > 1,SELECT city FROM employee WHERE age  <  30 GROUP BY city HAVING count(*)  >  1,tianyi,67d9c297-70e2-43da-a7d3-fe7cf8f0d258,F1,zhengning,66a9172e-a720-400a-9723-2734cd7bf448,"N3, F1"
413,413,1677,Find the number of employees hired in each shop; show the shop name as well.,"SELECT shop.Name, COUNT(*) FROM hiring JOIN shop ON hiring.Shop_ID = shop.Shop_ID GROUP BY hiring.Shop_ID","SELECT count(*) ,  t2.name FROM hiring AS t1 JOIN shop AS t2 ON t1.shop_id  =  t2.shop_id GROUP BY t2.name",tianyi,d9e5217f-b0d1-4d24-9ef4-52a05bb96d6b,BN1,zhengning,22d85713-7d0b-4cc2-a598-5e97d2b0666c,BN1
414,414,1678,"For each shop, return the number of employees working there and the name of the shop.","SELECT shop.Name, COUNT(*) FROM hiring JOIN shop ON hiring.Shop_ID = shop.Shop_ID GROUP BY hiring.Shop_ID","SELECT count(*) ,  t2.name FROM hiring AS t1 JOIN shop AS t2 ON t1.shop_id  =  t2.shop_id GROUP BY t2.name",tianyi,e17d3062-0ef1-4c1d-b36c-1b80d1bc1006,BN1,zhengning,3565ba91-1ad1-436e-94c4-99927d17adba,BN1
415,415,1683,List the number of different series names and contents in the TV Channel table.,"SELECT COUNT(DISTINCT TV_Channel.series_name), COUNT(TV_Channel.Content) FROM TV_Channel","SELECT count(DISTINCT series_name) ,  count(DISTINCT content) FROM TV_Channel;",tianyi,580a4f9a-27d3-48ae-ba90-19d54a8c2683,A1b,zhengning,9a439c1a-6f35-40ff-bf57-317c89e25b0f,"BL1, A1b"
416,416,1684,How many different series and contents are listed in the TV Channel table?,"SELECT COUNT(DISTINCT TV_Channel.series_name), COUNT(TV_Channel.Content) FROM TV_Channel","SELECT count(DISTINCT series_name) ,  count(DISTINCT content) FROM TV_Channel;",tianyi,b4c5f18d-5c2d-449a-a7a6-9c528b2568ee,A1b,zhengning,fca3d1b2-cd70-461a-95a1-32baec23396f,"BL1, A1b"
417,417,1687,"What is the TV Channel that shows the cartoon ""The Rise of the Blue Beetle!""? List the TV Channel's series name.","SELECT TV_Channel.series_name FROM Cartoon JOIN TV_Channel ON TV_Channel.id = Cartoon.Channel WHERE Cartoon.Title = ""the Rise of the Blue Beetle !""","SELECT T1.series_name FROM TV_Channel AS T1 JOIN Cartoon AS T2 ON T1.id = T2.Channel WHERE T2.Title = ""The Rise of the Blue Beetle!"";",tianyi,a9695308-883f-4dc4-959e-006f6a60da41,"D1a, D1c",zhengning,d6cd8fb2-b3c6-41ad-b758-6f69bfa22059,D1
418,418,1688,"What is the series name of the TV Channel that shows the cartoon ""The Rise of the Blue Beetle""?","SELECT TV_Channel.series_name FROM Cartoon JOIN TV_Channel ON TV_Channel.id = Cartoon.Channel WHERE Cartoon.Title = ""the Rise of the Blue Beetle""","SELECT T1.series_name FROM TV_Channel AS T1 JOIN Cartoon AS T2 ON T1.id = T2.Channel WHERE T2.Title = ""The Rise of the Blue Beetle!"";",tianyi,afbdced8-ede0-442f-b28c-d14f302f8680,D1 ,zhengning,22a04acb-b40c-4708-96fc-3ac15b4b6329,D1
419,419,1689,"List the title of all  Cartoons showed on TV Channel with series name ""Sky Radio"".","SELECT Cartoon.Title FROM Cartoon JOIN TV_series ON TV_series.id = Cartoon.Channel JOIN TV_Channel ON TV_Channel.id = TV_series.Channel WHERE TV_Channel.series_name = ""Sky Radio""","SELECT T2.Title FROM TV_Channel AS T1 JOIN Cartoon AS T2 ON T1.id = T2.Channel WHERE T1.series_name = ""Sky Radio"";",tianyi,ae8d0a13-957d-4b7f-bce9-819a87f64f85,"CE3, E1",zhengning,a1a4f1df-cfe2-4fc7-8574-c8c6c1607adb,E1
420,420,1690,"What is the title of all the cartools that are on the TV Channel with the series name ""Sky Radio""?","SELECT TV_series.Episode FROM TV_Channel JOIN TV_series ON TV_Channel.id = TV_series.Channel WHERE TV_Channel.series_name = ""Sky Radio""","SELECT T2.Title FROM TV_Channel AS T1 JOIN Cartoon AS T2 ON T1.id = T2.Channel WHERE T1.series_name = ""Sky Radio"";",tianyi,f16d6abb-cc28-4f68-abab-6574f6c015f6,"BL1, CE3",zhengning,ab81fc88-5cf7-4771-b2ad-e94def1a8284,"CE3, CL1"
421,421,1693,What is minimum and maximum share of TV series?,"SELECT MIN(TV_series.Share), MAX(TV_series.Share) FROM TV_series","SELECT max(SHARE) , min(SHARE) FROM TV_series;",tianyi,109debe1-79f5-4875-8989-25b17b8dae82,,zhengning,29cbe621-2052-44cc-a72e-595ffa9445e7,
422,422,1695,"What is the TV Channel of TV series with Episode ""A Love of a Lifetime""? List the TV Channel's series name.","SELECT TV_series.Channel FROM TV_series WHERE TV_series.Episode = ""A Love of A Lifetime""","SELECT T1.series_name FROM TV_Channel AS T1 JOIN TV_series AS T2 ON T1.id = T2.Channel WHERE T2.Episode = ""A Love of a Lifetime"";",tianyi,6bd93625-6a5d-493d-a899-6790c657ea19,"BL1, D1a, CE2",zhengning,c5500611-0e84-4d75-bc24-b72191a7d314,"BL1, CE2, D1a"
423,423,1696,"What is the name of the series that has the episode ""A Love of a Lifetime""?","SELECT TV_series.Episode FROM TV_series WHERE TV_series.Episode = ""A Love of A Lifetime""","SELECT T1.series_name FROM TV_Channel AS T1 JOIN TV_series AS T2 ON T1.id = T2.Channel WHERE T2.Episode = ""A Love of a Lifetime"";",tianyi,962bf69b-8244-4f9c-8db8-9dc8c2a11b0a,"BL1, E1, D1a",zhengning,6d928b5e-4546-4dce-9405-1f0cb44ee7ca,"BL1, CE2, D1a"
424,424,1703,Find the package choice and series name of the TV channel that has high definition TV.,"SELECT TV_Channel.Package_Option, TV_Channel.series_name FROM TV_Channel JOIN TV_series ON TV_Channel.id = TV_series.Channel WHERE TV_Channel.Hight_definition_TV = ""t""","SELECT package_option ,  series_name FROM TV_Channel WHERE hight_definition_TV  =  ""yes""",tianyi,03c34169-ef25-4b57-a73e-244c0d85ca88,"E1, D1",zhengning,41c2c779-40fb-4ee7-83d6-744caa672d73,"D1c, E1"
425,425,1704,What are the package options and the name of the series for the TV Channel that supports high definition TV?,"SELECT TV_Channel.Package_Option, TV_Channel.series_name FROM TV_Channel WHERE TV_Channel.Hight_definition_TV = ""high definition TV""","SELECT package_option ,  series_name FROM TV_Channel WHERE hight_definition_TV  =  ""yes""",tianyi,a36002b0-ade3-46bd-9cc5-d76a34f54b52,D1,zhengning,55294025-87d7-422a-a583-44a9b8060ef6,D1
426,426,1709,What are the distinct creation years of the departments managed by a secretary born in state 'Alabama'?,"SELECT DISTINCT department.Creation FROM management JOIN head ON management.department_ID = head.head_ID JOIN department ON management.department_ID = department.Department_ID WHERE head.born_state = ""Alabama""",SELECT DISTINCT T1.creation FROM department AS T1 JOIN management AS T2 ON T1.department_id  =  T2.department_id JOIN head AS T3 ON T2.head_id  =  T3.head_id WHERE T3.born_state  =  'Alabama',tianyi,c17c6a3c-6a97-4a5e-b479-da31abacd882,BE5,zhengning,fc5bc5f5-ffd2-4df1-ae7d-0c57635369ca,CE3
427,427,1714,Find the level name of the catalog with the lowest price (in USD).,SELECT Catalogs.catalog_name FROM Catalogs JOIN Catalog_Contents ON Catalogs.catalog_id = Catalog_Contents.catalog_level_number ORDER BY Catalog_Contents.price_in_dollars LIMIT 1,SELECT t2.catalog_level_name FROM catalog_contents AS t1 JOIN catalog_structure AS t2 ON t1.catalog_level_number  =  t2.catalog_level_number ORDER BY t1.price_in_dollars LIMIT 1,tianyi,2e8d4479-a016-4577-8d6e-96947d06e48e,"BL1, BE5",zhengning,ada14255-d439-4f8c-abc0-bffcc39a2d11,"CL1, CE3"
428,428,1715,Show the album names and ids for albums that contain tracks with unit price bigger than 1.,"SELECT Track.Name, Album.AlbumId FROM Album JOIN Track ON Album.AlbumId = Track.AlbumId WHERE Track.UnitPrice > 1","SELECT T1.Title ,  T2.AlbumID FROM ALBUM AS T1 JOIN TRACK AS T2 ON T1.AlbumId  =  T2.AlbumId WHERE T2.UnitPrice  >  1 GROUP BY T2.AlbumID",tianyi,b5071d1e-3295-4670-8e60-af563476667d,"BL1, AN2",zhengning,586f5ad4-bffc-42f6-b181-6c7a1d10e294,"BL1, AN2"
429,429,1716,What are the titles and ids for albums containing tracks with unit price greater than 1?,"SELECT Album.Title, Album.AlbumId FROM Album JOIN Track ON Album.AlbumId = Track.AlbumId WHERE Track.UnitPrice > 1","SELECT T1.Title ,  T2.AlbumID FROM ALBUM AS T1 JOIN TRACK AS T2 ON T1.AlbumId  =  T2.AlbumId WHERE T2.UnitPrice  >  1 GROUP BY T2.AlbumID",tianyi,09a5a6ae-be76-49f8-a5cf-370815c82b91,"AN2, CL1",zhengning,191702e8-f183-4da2-b278-d280f6a24443,"AN2, CL1"
430,430,1717,Find all the customer last names that do not have invoice totals larger than 20.,SELECT Customer.LastName FROM Customer EXCEPT SELECT Customer.LastName FROM Customer JOIN Invoice ON Customer.CustomerId = Invoice.CustomerId GROUP BY Customer.LastName HAVING SUM(Invoice.Total) > 20,SELECT LastName FROM CUSTOMER EXCEPT SELECT T1.LastName FROM CUSTOMER AS T1 JOIN Invoice AS T2 ON T1.CustomerId  =  T2.CustomerId WHERE T2.total  >  20,tianyi,ad80ea71-216d-4c6b-a271-7264f019d90e,"N3, L4",zhengning,24a99376-2b14-4dd1-88ba-a69be0c2fd32,N3
431,431,1721,Please list the name and id of all artists that have at least 3 albums in alphabetical order.,"SELECT Artist.Name, Album.ArtistId FROM Artist JOIN Album ON Artist.ArtistId = Album.ArtistId GROUP BY Album.ArtistId HAVING COUNT(*) >= 3 ORDER BY Album.ArtistId","SELECT T2.Name ,  T1.ArtistId FROM ALBUM AS T1 JOIN ARTIST AS T2 ON T1.ArtistId  =  T2.ArtistID GROUP BY T1.ArtistId HAVING COUNT(*)  >=  3 ORDER BY T2.Name",tianyi,4d971287-a58e-4e58-afc6-b2c9dbabfeb5,BK1,zhengning,42cfc9a3-94ad-4648-9a74-2c6844bceda3,"BK1, CL1"
432,432,1722,"What are the names and ids of artists with 3 or more albums, listed in alphabetical order?","SELECT Artist.Name, Artist.ArtistId FROM Artist JOIN Album ON Artist.ArtistId = Album.ArtistId GROUP BY Album.ArtistId HAVING COUNT(*) >= 3","SELECT T2.Name ,  T1.ArtistId FROM ALBUM AS T1 JOIN ARTIST AS T2 ON T1.ArtistId  =  T2.ArtistID GROUP BY T1.ArtistId HAVING COUNT(*)  >=  3 ORDER BY T2.Name",tianyi,f34e1171-2d14-4536-ab4d-316a4dd06f05,"BK1, CL1",zhengning,4ab26eb5-2207-4964-86dd-c9afa2495337,"KA1b, CL1"
433,433,1723,Find the names of artists that do not have any albums.,SELECT Artist.Name FROM Artist WHERE Artist.ArtistId NOT IN (SELECT Album.ArtistId FROM Album),SELECT Name FROM ARTIST EXCEPT SELECT T2.Name FROM ALBUM AS T1 JOIN ARTIST AS T2 ON T1.ArtistId  =  T2.ArtistId,tianyi,fc17f17e-d154-49ed-8deb-fb0dbdaa935c,,zhengning,0fff43fc-022f-4895-9546-b7575139e795,"CE2, A1d"
434,434,1724,What are the names of artists who have not released any albums?,SELECT Artist.Name FROM Artist WHERE Artist.ArtistId NOT IN (SELECT Album.ArtistId FROM Album),SELECT Name FROM ARTIST EXCEPT SELECT T2.Name FROM ALBUM AS T1 JOIN ARTIST AS T2 ON T1.ArtistId  =  T2.ArtistId,tianyi,c491de57-7ece-44c0-987d-6ca915101efd,,zhengning,70221995-da87-43c8-8fb0-d66e1b98c37b,"CE2, A1d"
435,435,1725,What are the names of enzymes in the medicine named 'Amisulpride' that can serve as an 'inhibitor'?,"SELECT enzyme.name FROM enzyme JOIN medicine_enzyme_interaction ON enzyme.id = medicine_enzyme_interaction.enzyme_id JOIN medicine ON medicine_enzyme_interaction.medicine_id = medicine.id WHERE medicine.name = ""Amisulpride"" AND medicine_enzyme_interaction.medicine_id = ""inhibitor""",SELECT T1.name FROM enzyme AS T1 JOIN medicine_enzyme_interaction AS T2 ON T1.id  =  T2.enzyme_id JOIN medicine AS T3 ON T2.medicine_id  =  T3.id WHERE T3.name  =  'Amisulpride' AND T2.interaction_type  =  'inhibitor',tianyi,c429b710-d29a-42cb-b8fc-0e4a4e47c29e,"BL1, E1, N3, L4, BF4, D1c, CE2",zhengning,71b42a61-1303-4142-bd45-8673780ee799,BF4
436,436,1727,"What are the ids, names and FDA approval status of medicines in descending order of the number of enzymes that it can interact with.","SELECT medicine.id, medicine.name, medicine.FDA_approved FROM medicine JOIN medicine_enzyme_interaction ON medicine.id = medicine_enzyme_interaction.enzyme_id GROUP BY medicine.id ORDER BY COUNT(*) DESC","SELECT T1.id ,  T1.Name ,  T1.FDA_approved FROM medicine AS T1 JOIN medicine_enzyme_interaction AS T2 ON T2.medicine_id  =  T1.id GROUP BY T1.id ORDER BY count(*) DESC",tianyi,da6fde3d-6379-4ce4-bf45-5e23472873b6,BE5,zhengning,dca794a7-d2d1-48ee-ace9-66d1b277beb4,BE5
