,sql_id,coder,code_ning,username,error_classification,sql,GT_sql
0,93,zhengning,D1c,tianyi,D1c,SELECT cars_data.accelerate FROM cars_data JOIN car_names ON cars_data.id = car_names.makeid WHERE car_names.make = 'amc hornet sportabout (sw',SELECT T1.Accelerate FROM CARS_DATA AS T1 JOIN CAR_NAMES AS T2 ON T1.Id  =  T2.MakeId WHERE T2.Make  =  'amc hornet sportabout (sw)';
2,182,zhengning,D1,tianyi,D1c,SELECT cars_data.accelerate FROM cars_data JOIN car_names ON cars_data.id = car_names.makeid WHERE car_names.make = 'amc hornet sportabout (sw',SELECT T1.Accelerate FROM CARS_DATA AS T1 JOIN CAR_NAMES AS T2 ON T1.Id  =  T2.MakeId WHERE T2.Make  =  'amc hornet sportabout (sw)';
4,94,zhengning,"A1d, CL1",tianyi,"A1d, F1",SELECT DISTINCT artist.artist_name FROM artist JOIN song ON artist.artist_name = song.artist_name WHERE artist.country = 'Bangladesh' AND song.rating > 7,"SELECT DISTINCT artist_name FROM artist WHERE country  =  ""Bangladesh"" EXCEPT SELECT DISTINCT artist_name FROM song WHERE rating  >  7"
5,95,zhengning,"CL1, BL3",tianyi,"BN1, BL1","SELECT hall_of_fame.ballots , COUNT( * ) FROM hall_of_fame GROUP BY hall_of_fame.ballots","SELECT yearid ,  count(*) FROM hall_of_fame GROUP BY yearid;"
6,96,zhengning,D1a,tianyi,D1a,SELECT faculty.room FROM faculty WHERE faculty.rank = 'professor' AND faculty.building = 'NEB',"SELECT Room FROM FACULTY WHERE Rank  =  ""Professor"" AND Building  =  ""NEB"""
7,97,zhengning,F4,tianyi,"D1, D1c, CE2","SELECT checking.balance , savings.balance FROM accounts JOIN checking ON accounts.custid = checking.custid WHERE accounts.name = 'Brown’s'","SELECT T2.balance ,  T3.balance FROM accounts AS T1 JOIN checking AS T2 ON T1.custid  =  T2.custid JOIN savings AS T3 ON T1.custid  =  T3.custid WHERE T1.name  =  'Brown'"
8,98,zhengning,D1a,tianyi,D1a,"SELECT medicine.name , medicine.trade_name FROM medicine WHERE medicine.fda_approved = 'yes'","SELECT name ,  trade_name FROM medicine WHERE FDA_approved  =  'Yes'"
9,99,zhengning,"F3, F4",tianyi,F3,SELECT project_staff.role_code FROM project_staff WHERE project_staff.staff_id = 1 AND project_staff.date_from = 1 AND project_staff.date_to = 1 AND project_staff.date_from = 1 AND project_staff.date_to = 1,SELECT role_code FROM Project_Staff WHERE date_from  >  '2003-04-19 15:06:20' AND date_to  <  '2016-03-15 00:33:18'
10,100,zhengning,D1,tianyi,F3,"SELECT mountain.id , mountain.name FROM mountain JOIN photos ON mountain.id = photos.mountain_id WHERE mountain.height > 'mountains'","SELECT T1.id ,  T1.name FROM mountain AS T1 JOIN photos AS T2 ON T1.id  =  T2.mountain_id WHERE T1.height  >  4000"
11,100,zhengning,D1,tianyi,F3,"SELECT mountain.id , mountain.name FROM mountain JOIN photos ON mountain.id = photos.mountain_id WHERE mountain.height > 'mountains'","SELECT T1.id ,  T1.name FROM mountain AS T1 JOIN photos AS T2 ON T1.id  =  T2.mountain_id WHERE T1.height  >  4000"
12,101,zhengning,"N3, CL1",tianyi,N3,"SELECT album.title , album.albumid FROM album JOIN track ON album.albumid = track.albumid WHERE track.unitprice > 1","SELECT T1.Title ,  T2.AlbumID FROM ALBUM AS T1 JOIN TRACK AS T2 ON T1.AlbumId  =  T2.AlbumId WHERE T2.UnitPrice  >  1 GROUP BY T2.AlbumID"
13,102,zhengning,D1a,tianyi,D1a,SELECT student.lname FROM sportsinfo JOIN student ON sportsinfo.stuid = student.stuid WHERE sportsinfo.onscholarship = 'y',SELECT T2.Lname FROM Sportsinfo AS T1 JOIN Student AS T2 ON T1.StuID  =  T2.StuID WHERE T1.onscholarship  =  'Y'
14,103,zhengning,D1a,tianyi,D1a,SELECT COUNT( * ) FROM lessons WHERE lessons.lesson_status_code = 'cancelled',"SELECT count(*) FROM Lessons WHERE lesson_status_code = ""Cancelled"";"
15,104,zhengning,F4,tianyi,DF2,SELECT addresses.state_province_county FROM addresses JOIN staff ON addresses.address_id = staff.staff_address_id GROUP BY addresses.state_province_county HAVING COUNT( * ) >= 2,SELECT T1.state_province_county FROM Addresses AS T1 JOIN Staff AS T2 ON T1.address_id = T2.staff_address_id GROUP BY T1.state_province_county HAVING count(*) BETWEEN 2 AND 4;
16,105,zhengning,F4,tianyi,"BL1, F4",SELECT COUNT( * ) FROM customers JOIN lessons ON customers.customer_id = lessons.customer_id WHERE customers.first_name = 'Rylan' AND customers.last_name = 'Goodwin',"SELECT count(*) FROM Lessons AS T1 JOIN Customers AS T2 ON T1.customer_id  = T2.customer_id WHERE T2.first_name = ""Rylan"" AND T2.last_name = ""Goodwin"" AND T1.lesson_status_code = ""Completed"";"
17,145,zhengning,F4,tianyi,F4,"SELECT DISTINCT artist.artist_name , artist.country FROM artist JOIN song ON artist.artist_name = song.artist_name WHERE song.resolution > 900","SELECT T1.artist_name ,  T1.country FROM artist AS T1 JOIN song AS T2 ON T1.artist_name  =  T2.artist_name WHERE T2.resolution  >  900 GROUP BY T2.artist_name HAVING count(*)  >=  1"
18,146,zhengning,CE2,tianyi,F4,SELECT lessons.lesson_id FROM lessons JOIN staff ON lessons.staff_id = staff.staff_id WHERE staff.nickname LIKE '%s%',"SELECT T1.lesson_id FROM Lessons AS T1 JOIN Staff AS T2 ON T1.staff_id = T2.staff_id WHERE T2.first_name = ""Janessa"" AND T2.last_name = ""Sawayn"" AND nickname LIKE ""%s%"";"
19,147,zhengning,D1a,tianyi,D1a,SELECT AVG( track.unitprice ) FROM genre JOIN track ON genre.genreid = track.genreid WHERE genre.name = 'jazz',"SELECT AVG(UnitPrice) FROM GENRE AS T1 JOIN TRACK AS T2 ON T1.GenreId  =  T2.GenreId WHERE T1.Name  =  ""Jazz"""
20,148,zhengning,L4,tianyi,L4,SELECT AVG( customer.credit_score ) FROM customer JOIN loan ON customer.cust_id = loan.cust_id,SELECT avg(credit_score) FROM customer WHERE cust_id IN (SELECT cust_id FROM loan)
21,150,zhengning,CE2,tianyi,CE2,SELECT AVG( gradeconversion.gradepoint ) FROM student WHERE student.lname = 'Smith',"SELECT avg(T2.gradepoint) FROM ENROLLED_IN AS T1 JOIN GRADECONVERSION AS T2 JOIN STUDENT AS T3 ON T1.Grade  =  T2.lettergrade AND T1.StuID  =  T3.StuID WHERE T3.LName  =  ""Smith"""
22,151,zhengning,"A1b, A1d",tianyi,"A1b, A1d",SELECT artist.artist_name FROM artist JOIN song ON artist.artist_name = song.artist_name WHERE artist.country = 'Bangladesh' AND song.rating > 7,"SELECT DISTINCT artist_name FROM artist WHERE country  =  ""Bangladesh"" EXCEPT SELECT DISTINCT artist_name FROM song WHERE rating  >  7"
23,152,zhengning,BF4,tianyi,BF4,SELECT COUNT( * ) FROM postseason WHERE postseason.losses = 1885 AND postseason.ties = 1,SELECT count(*) FROM postseason WHERE YEAR  =  1885 AND ties  =  1;
24,153,zhengning,"L4, KA1b, BL3",tianyi,"KA1b, BL3","SELECT accounts.name FROM accounts, checking, savings WHERE accounts.name = (SELECT accounts.name , checking.balance , savings.balance , SUM( savings.balance ) FROM accounts JOIN checking ON accounts.custid = checking.custid JOIN savings ON checking.balance = savings.custid)","SELECT T2.balance ,  T3.balance ,  T1.name FROM accounts AS T1 JOIN checking AS T2 ON T1.custid  =  T2.custid JOIN savings AS T3 ON T1.custid  =  T3.custid ORDER BY T2.balance + T3.balance DESC"
25,154,zhengning,BL3,tianyi,BL3,"SELECT MAX( files.duration ) , AVG( song.resolution ) FROM files JOIN song ON files.f_id = song.f_id ORDER BY song.languages ASC","SELECT max(T1.duration) ,  max(T2.resolution) ,  T2.languages FROM files AS T1 JOIN song AS T2 ON T1.f_id  =  T2.f_id GROUP BY T2.languages ORDER BY T2.languages"
26,155,zhengning,P3,tianyi,P3,SELECT COUNT( * ) FROM participants JOIN participants_in_events ON participants.participant_id = participants_in_events.participant_id WHERE participants.participant_details LIKE '%Dr%',SELECT count(*) FROM participants AS T1 JOIN Participants_in_Events AS T2 ON T1.Participant_ID  =  T2.Participant_ID WHERE T1.participant_details LIKE '%Dr.%'
27,156,zhengning,D1a,tianyi,D1a,SELECT COUNT( * ) FROM medicine WHERE medicine.fda_approved = 'no',SELECT count(*) FROM medicine WHERE FDA_approved  =  'No'
28,157,zhengning,D1a,tianyi,D1a,"SELECT DISTINCT student.fname , student.lname FROM student JOIN member_of_club ON student.stuid = member_of_club.stuid JOIN club ON club.clubid = member_of_club.clubid WHERE club.clubname = 'Bootup Baltimore' AND student.sex = 'f'","SELECT t3.fname ,  t3.lname FROM club AS t1 JOIN member_of_club AS t2 ON t1.clubid  =  t2.clubid JOIN student AS t3 ON t2.stuid  =  t3.stuid WHERE t1.clubname  =  ""Bootup Baltimore"" AND t3.sex  =  ""F"""
29,158,zhengning,D1a,tianyi,D1a,"SELECT DISTINCT student.fname , student.lname FROM club JOIN member_of_club ON club.clubid = member_of_club.clubid JOIN student ON student.stuid = member_of_club.stuid WHERE club.clubname = 'Bootup Baltimore' AND member_of_club.position = 'president'","SELECT t3.fname ,  t3.lname FROM club AS t1 JOIN member_of_club AS t2 ON t1.clubid  =  t2.clubid JOIN student AS t3 ON t2.stuid  =  t3.stuid WHERE t1.clubname  =  ""Bootup Baltimore"" AND t2.position  =  ""President"""
30,159,zhengning,D1c,tianyi,D1c,"SELECT AVG( singer.age ) , MIN( singer.age ) , MAX( singer.age ) FROM singer WHERE singer.country = 'French'","SELECT avg(age) ,  min(age) ,  max(age) FROM singer WHERE country  =  'France'"
31,160,zhengning,"CL3, F1",tianyi,"CL1, E1","SELECT ref_document_types.document_type_name , COUNT( * ) FROM documents JOIN ref_document_types ON documents.document_type_code = ref_document_types.document_type_code GROUP BY documents.document_type_code","SELECT document_type_code ,  count(*) FROM Documents GROUP BY document_type_code"
32,161,zhengning,CE3,tianyi,CE3 ,SELECT procedures.name FROM procedures JOIN trained_in ON procedures.code = trained_in.treatment JOIN physician ON trained_in.physician = physician.employeeid WHERE physician.name = 'John Wen' AND procedures.cost<5000,"SELECT name FROM procedures WHERE cost  <  5000 INTERSECT SELECT T3.name FROM physician AS T1 JOIN trained_in AS T2 ON T1.employeeid  =  T2.physician JOIN procedures AS T3 ON T3.code  =  T2.treatment WHERE T1.name  =  ""John Wen"""
33,162,zhengning,"E1, A1d",tianyi,"E1, A1d",SELECT procedures.name FROM procedures JOIN trained_in ON procedures.code = trained_in.treatment JOIN physician ON trained_in.physician = physician.employeeid JOIN procedures ON procedures.code = trained_in.treatment JOIN physician ON physician.employeeid = trained_in.physician WHERE physician.name != 'John Wen' AND procedures.cost > 1000,"SELECT name FROM procedures WHERE cost  >  1000 EXCEPT SELECT T3.name FROM physician AS T1 JOIN trained_in AS T2 ON T1.employeeid  =  T2.physician JOIN procedures AS T3 ON T3.code  =  T2.treatment WHERE T1.name  =  ""John Wen"""
34,163,zhengning,D1b,tianyi,D1b,SELECT customer.cust_name FROM customer EXCEPT SELECT customer.cust_name FROM customer JOIN loan ON customer.cust_id = loan.cust_id WHERE loan.loan_type = 'Mortage',SELECT cust_name FROM customer EXCEPT SELECT T1.cust_name FROM customer AS T1 JOIN loan AS T2 ON T1.cust_id  =  T2.cust_id WHERE T2.loan_type  =  'Mortgages'
35,164,zhengning,CL1,tianyi,CL1,SELECT physician.name FROM prescribes JOIN medication ON prescribes.medication = medication.code JOIN prescribes ON physician.employeeid = prescribes.physician WHERE medication.name = 'Thesisin',"SELECT DISTINCT T1.name FROM physician AS T1 JOIN prescribes AS T2 ON T1.employeeid = T2.physician JOIN medication AS T3 ON T3.code = T2.medication WHERE T3.name  =  ""Thesisin"""
36,165,zhengning,"A1b, L4",tianyi,"A1b, L4","SELECT DISTINCT tv_channel.series_name , tv_channel.content FROM tv_channel","SELECT count(DISTINCT series_name) ,  count(DISTINCT content) FROM TV_Channel;"
37,173,zhengning,E1,tianyi,E1,SELECT COUNT( * ) FROM addresses JOIN staff ON addresses.address_id = staff.staff_address_id WHERE addresses.state_province_county = 'Georgia',"SELECT count(*) FROM Addresses WHERE state_province_county = ""Georgia"";"
38,174,zhengning,D1,tianyi,D1c,SELECT video_games.gname FROM video_games WHERE video_games.gtype = 'collectible cards',"SELECT gname FROM Video_games WHERE gtype  =  ""Collectible card game"""
39,175,zhengning,D1a,tianyi,D1a,SELECT sportsinfo.stuid FROM sportsinfo WHERE sportsinfo.onscholarship = 'y',SELECT StuID FROM Sportsinfo WHERE onscholarship  =  'Y'
40,176,zhengning,CF5,tianyi,CF5 ,SELECT person.name FROM person WHERE personfriend.friend NOT IN (SELECT personfriend.name FROM personfriend),SELECT name FROM person EXCEPT SELECT name FROM PersonFriend
41,177,zhengning,BF4,tianyi,BF4,SELECT COUNT( * ) FROM home_game JOIN park ON home_game.park_id = park.park_id WHERE home_game.attendance = 1907 AND park.park_alias = 'Columbia Park',SELECT count(*) FROM home_game AS T1 JOIN park AS T2 ON T1.park_id  =  T2.park_id WHERE T1.year = 1907 AND T2.park_name = 'Columbia Park';
42,178,zhengning,DF2,tianyi,D1,SELECT SUM( salary.salary ) FROM salary JOIN player ON salary.player_id = player.player_id WHERE player.name_first = 'Barker' AND player.name_last = 'Len' AND salary.year BETWEEN 1985 and 1990,SELECT sum(T1.salary) FROM salary AS T1 JOIN player AS T2 ON T1.player_id = T2.player_id WHERE T2.name_first  =  'Len' AND T2.name_last = 'Barker' AND T1.year BETWEEN 1985 AND 1990;
43,179,zhengning,D1c,tianyi,D1c,"SELECT COUNT( * ) , airports.city FROM airports WHERE airports.country = 'US' GROUP BY airports.city ORDER BY COUNT( * ) DESC","SELECT count(*) ,  city FROM airports WHERE country  =  'United States' GROUP BY city ORDER BY count(*) DESC"
44,180,zhengning,"CL1, D1a",tianyi,"D1a, CL1","SELECT DISTINCT personfriend.name , person.age FROM person JOIN personfriend ON person.name = personfriend.name WHERE person.gender = 'Dan' OR person.gender = 'alice'","SELECT DISTINCT T1.name ,  T1.age FROM Person AS T1 JOIN PersonFriend AS T2 ON T1.name  =  T2.name WHERE T2.friend  =  'Dan' OR T2.friend  =  'Alice'"
45,181,zhengning,"CL1, D1a",tianyi,D1a,SELECT student.stuid FROM sportsinfo JOIN student ON sportsinfo.stuid = student.stuid WHERE student.sex = 'm' AND sportsinfo.sportname != 'football',"SELECT StuID FROM Student WHERE sex  =  'M' EXCEPT SELECT StuID FROM Sportsinfo WHERE sportname  =  ""Football"""