,Unnamed: 0,sql_id,nl_query,sql,GT_sql,tianyi_code,zhengn_code
0,0,746,"Of all players with an overall rating greater than 80, how many are right-footed and left-footed?","SELECT COUNT(*) FROM Player_Attributes WHERE Player_Attributes.overall_rating > 80 AND Player_Attributes.preferred_foot = ""left-footed""","SELECT preferred_foot ,  count(*) FROM Player_Attributes WHERE overall_rating  >  80 GROUP BY preferred_foot","BL1, F3, F4, AN2, CE2","BL1, F3, BL3, AN2, CE2"
1,1,1088,Find the number of rooms for different block code?,"SELECT Block.BlockCode, COUNT(*) FROM Block JOIN Room ON Block.BlockFloor = Room.BlockCode GROUP BY Block.BlockCode","SELECT count(*) ,  T1.blockcode FROM BLOCK AS T1 JOIN room AS T2 ON T1.blockfloor  =  T2.blockfloor AND T1.blockcode  =  T2.blockcode GROUP BY T1.blockcode","BL1, F3, BE5, AN2, CE2","CE2, F3, BL3, AN2"
2,2,1317,"For the problem with id 10, return the ids and dates of its problem logs.","SELECT Problem_Log.problem_id, Problems.date_problem_reported FROM Problems JOIN Problem_Log ON Problems.problem_id = Problem_Log.problem_id WHERE Problem_Log.problem_log_id = 10","SELECT problem_log_id ,  log_entry_date FROM problem_log WHERE problem_id = 10","BL1, E1, BE5, BF4","BL1, E1, CE2"
3,3,548,How many lessons have been cancelled?,"SELECT COUNT(*) FROM Lessons WHERE Lessons.lesson_status_code = ""cancelled""","SELECT count(*) FROM Lessons WHERE lesson_status_code = ""Cancelled"";","BL1, E1, BF4, D1a","BL1, E1, D1a"
4,4,159,List all people names in the order of their date of birth from old to young.,SELECT people.Name FROM people ORDER BY people.Date_of_Birth DESC,SELECT name FROM people ORDER BY date_of_birth,"K2, D1a","K2, D1a"
5,5,375,How many students got accepted after the tryout?,SELECT * FROM College,SELECT count(*) FROM tryout WHERE decision  =  'yes',"L5, F4, CL1, K2","CL1, K2, F4"
6,6,1064,"List the id, genre and artist name of English songs ordered by rating.","SELECT song.song_name, song.genre_is, song.artist_name FROM genre JOIN song ON genre.g_name = song.f_id WHERE song.languages = ""English"" ORDER BY song.rating","SELECT f_id ,  genre_is ,  artist_name FROM song WHERE languages  =   ""english"" ORDER BY rating","L5, F4, D1a, CL1","F4, D1a, CE2, CL1"
7,7,1217,Show the names of customers having an order with shipping method FedEx and order status Paid.,"SELECT Customers.customer_name FROM Customers JOIN Customer_Orders ON Customers.customer_id = Customer_Orders.customer_id WHERE Customer_Orders.shipping_method_code = ""FedEx""",SELECT T1.customer_name FROM customers AS T1 JOIN customer_orders AS T2 ON T1.customer_id  =  T2.customer_id WHERE shipping_method_code  =  'FedEx' AND order_status_code  =  'Paid',"F4, D1a","CE2, BL1, F4, D1a"
8,8,930,Who are the lieutenant governor and comptroller from the democratic party?,"SELECT party.Lieutenant_Governor, party.Comptroller FROM party WHERE party.Party = ""democratic""","SELECT Lieutenant_Governor ,  Comptroller FROM party WHERE Party  =  ""Democratic""","F4, D1a","F4, D1a"
9,9,1220,"Find the first names of students whose first names contain letter ""a"".","SELECT Student.Fname FROM Student WHERE Student.Fname LIKE ""% a %""",SELECT DISTINCT Fname FROM STUDENT WHERE Fname LIKE '%a%',"A1b, P3, D1a","A1b, D1a, P3"
10,10,745,What is the average rating for right-footed players and left-footed players?,"SELECT AVG(Player_Attributes.overall_rating) FROM Player_Attributes WHERE Player_Attributes.preferred_foot = ""VALUE VALUE"" AND Player_Attributes.preferred_foot = ""left-footed""","SELECT preferred_foot ,  avg(overall_rating) FROM Player_Attributes GROUP BY preferred_foot","F3, BL3, AN2, A1b","A1b, F3, BL3, AN2"
11,11,612,What is the number of cartoones written by Joseph Kuhr?,"SELECT COUNT(DISTINCT Cartoon.Written_by) FROM Cartoon WHERE Cartoon.Written_by = ""Joseph Kuhr""","SELECT count(*) FROM Cartoon WHERE Written_by = ""Joseph Kuhr"";","A1b, F3, BL3, AN2","BL1, F3, BL3, AN2"
12,12,712,"Which enzyme names have the substring ""ALA""?","SELECT enzyme.name FROM enzyme WHERE enzyme.name LIKE ""% ALA %""","SELECT name FROM enzyme WHERE name LIKE ""%ALA%""",A1b,D1
13,13,831,List all the names of schools with an endowment amount smaller than or equal to 10.,SELECT School.School_name FROM School JOIN endowment ON School.School_id = endowment.School_id WHERE endowment.amount <= 10,SELECT T2.school_name FROM endowment AS T1 JOIN school AS T2 ON T1.school_id  =  T2.school_id GROUP BY T1.school_id HAVING sum(T1.amount)  <=  10,"F3, A1f, AN2","D1, AN2"
14,14,1377,Find the number and average age of students living in each city.,"SELECT Student.city_code, AVG(Student.Age) FROM Student GROUP BY Student.city_code","SELECT count(*) ,  avg(age) ,  city_code FROM student GROUP BY city_code","L5, F3, A1f, AN2","L5, AN2"
15,15,1247,What are the total number of domestic passengers at all London airports?,"SELECT SUM(airport.Total_Passengers) FROM airport WHERE airport.Airport_Name = ""London""","SELECT sum(Domestic_Passengers) FROM airport WHERE Airport_Name LIKE ""%London%""","L5, BL1, D1","L5, BL1, D1"
16,16,707,"For every medicine id, what are the names of the medicines that can interact with more than one enzyme?",SELECT medicine.name FROM medicine JOIN medicine_enzyme_interaction ON medicine.id = medicine_enzyme_interaction.medicine_id GROUP BY medicine_enzyme_interaction.medicine_id HAVING COUNT(*) > 1,"SELECT T1.id ,  T1.Name FROM medicine AS T1 JOIN medicine_enzyme_interaction AS T2 ON T2.medicine_id  =  T1.id GROUP BY T1.id HAVING count(*)  >=  2","BL1, BN1, BL3","BL1, BL3"
17,17,562,What is the count of cities with more than 3 airports?,SELECT COUNT(*) FROM airports GROUP BY airports.city HAVING COUNT(*) > 3,SELECT count(*) FROM (SELECT city FROM airports GROUP BY city HAVING count(*)  >  3),"BL1, BN1, D1, BL3","BL1, D1, BL3"
18,18,982,"What are the names of the different bank branches, and what are their total loan amounts?","SELECT bank.bname, SUM(loan.amount) FROM bank JOIN loan ON bank.branch_ID = loan.branch_ID GROUP BY loan.branch_ID","SELECT sum(amount) ,  T1.bname FROM bank AS T1 JOIN loan AS T2 ON T1.branch_id  =  T2.branch_id GROUP BY T1.bname","BL1, BN1","BL1, BN1"
19,19,853,What are the daily hire costs for the products with substring 'Book' in its name?,"SELECT Products_for_Hire.daily_hire_cost FROM Products_for_Hire WHERE Products_for_Hire.product_name LIKE ""% Book %""",SELECT daily_hire_cost FROM Products_for_hire WHERE product_name LIKE '%Book%',"D1, BN1","D1, BN1"
20,20,836,"What is the total budget amount for school ""Glenn"" in all years?","SELECT SUM(budget.total_budget_percent_invested) FROM budget JOIN School ON budget.School_id = School.School_id WHERE School.School_name = ""Glenn""",SELECT sum(T1.budgeted) FROM budget AS T1 JOIN school AS T2 ON T1.school_id  =  T2.school_id WHERE T2.school_name  =  'Glenn',"BL1, D1","BL1, D1"
21,21,697,What are the last names of employees who serve at most 20 customers?,SELECT Employee.LastName FROM Employee JOIN Customer ON Employee.EmployeeId = Customer.SupportRepId GROUP BY Customer.LastName HAVING COUNT(*) <= 20,SELECT T1.LastName FROM CUSTOMER AS T1 JOIN EMPLOYEE AS T2 ON T1.SupportRepId  =  T2.EmployeeId GROUP BY T1.SupportRepId HAVING COUNT(*)  <=  20,"BL1, BN1, CL1",CL1
22,22,1389,"Find the last name of the staff whose email address contains ""wrau"".","SELECT Staff.last_name FROM Staff WHERE Staff.email_address LIKE ""% wrau %""","SELECT last_name FROM staff WHERE email_address LIKE ""%wrau%""","D1c, BN1, CL1","CL1, D1"
23,23,663,"What are the titles of albums by the artist ""AC/DC""?","SELECT Album.Title FROM Album JOIN Artist ON Album.ArtistId = Artist.ArtistId WHERE Artist.Name = ""AC / DC""","SELECT Title FROM ALBUM AS T1 JOIN ARTIST AS T2 ON T1.ArtistId  =  T2.ArtistId WHERE T2.Name  =  ""AC/DC""",,
24,24,786,Count the number of financial transactions that correspond to each account id.,"SELECT Financial_Transactions.account_id, COUNT(*) FROM Financial_Transactions GROUP BY Financial_Transactions.account_id","SELECT count(*) ,  account_id FROM Financial_transactions","D1c, N3","D1, AN2"
25,25,528,What are all locations of train stations?,SELECT station.Location FROM station JOIN train_station ON station.Station_ID = train_station.Station_ID,SELECT DISTINCT LOCATION FROM station,"A1b, CE2, N3","A1b, CE2, E1"
26,26,425,What are the names of all the dorms that can accomdate more than 300 students?,SELECT Dorm.dorm_name FROM Dorm JOIN Lives_in ON Dorm.dormid = Lives_in.dormid WHERE Lives_in.stuid > 300 GROUP BY Dorm.dormid,SELECT dorm_name FROM dorm WHERE student_capacity  >  300,"A1b, CE2, AN2","A1b, CE2, AN2"
27,27,769,"Show the id, the date of account opened, the account name, and other account detail for all accounts.","SELECT Accounts.account_id, Accounts.date_account_opened, Accounts.other_account_details FROM Accounts","SELECT account_id ,  date_account_opened ,  account_name ,  other_account_details FROM Accounts","BL3, AN2, E1","E1, BL3, AN2"
28,28,1092,Find the name of physicians whose position title contains the word 'senior'.,"SELECT Physician.Name FROM Physician WHERE Physician.Position LIKE ""% senior %""",SELECT name FROM physician WHERE POSITION LIKE '%senior%',"D1c, BL3","D1, BL3"
29,29,704,What are the names and trade names of the medicines which has 'Yes' value in the FDA record?,"SELECT medicine.name, medicine.Trade_Name FROM medicine WHERE medicine.FDA_approved = ""yes""","SELECT name ,  trade_name FROM medicine WHERE FDA_approved  =  'Yes'","D1c, D1a","D1, D1a"
30,30,457,What are the names of all video games that are collectible cards?,SELECT Video_Games.GName FROM Video_Games,"SELECT gname FROM Video_games WHERE gtype  =  ""Collectible card game""","F4, D1a","F4, D1a"
31,31,646,Find the name of the product that has the smallest capacity.,SELECT Catalog_Contents.product_stock_number FROM Catalog_Contents ORDER BY Catalog_Contents.capacity LIMIT 1,SELECT catalog_entry_name FROM catalog_contents ORDER BY capacity ASC LIMIT 1,"BL1, F4, K2","BL1, K2, F4"
32,32,1269,What is the name of every college in alphabetical order that has more than 18000 students enrolled?,SELECT College.cName FROM College WHERE College.enr > 18000,SELECT cName FROM College WHERE enr  >  18000 ORDER BY cName,"BL1, KA1b","BL1, K2, KA1b"
33,33,1093,What are the names of the physicians who have 'senior' in their titles.,"SELECT Physician.Name FROM Physician WHERE Physician.Name LIKE ""% senior %""",SELECT name FROM physician WHERE POSITION LIKE '%senior%',"KA1b, BF4","KA1b, BF4"
34,34,211,How many fault status codes are recorded in the fault log parts table?,SELECT COUNT(DISTINCT Fault_Log_Parts.fault_status) FROM Fault_Log_Parts,SELECT DISTINCT fault_status FROM Fault_Log_Parts,"L4, BF4","L4, BF4"
35,35,694,Please show the employee first names and ids of employees who serve at least 10 customers.,"SELECT Employee.FirstName, Employee.EmployeeId FROM Customer JOIN Employee ON Customer.SupportRepId = Employee.EmployeeId GROUP BY Employee.EmployeeId HAVING COUNT(*) >= 10","SELECT T1.FirstName ,  T1.SupportRepId FROM CUSTOMER AS T1 JOIN EMPLOYEE AS T2 ON T1.SupportRepId  =  T2.EmployeeId GROUP BY T1.SupportRepId HAVING COUNT(*)  >=  10","BN1, L4","L4, CL1, BN1"
36,36,238,What are the names of all songs in English?,"SELECT song.song_name FROM song WHERE song.languages = ""English""","SELECT song_name FROM song WHERE languages  =  ""english""","BN1, D1a","CL1, D1a, BN1"
37,37,820,"What are the names of customers with accounts, and what are the total savings balances for each?","SELECT ACCOUNTS.name, SUM(SAVINGS.balance) FROM SAVINGS JOIN ACCOUNTS ON SAVINGS.custid = ACCOUNTS.custid GROUP BY SAVINGS.custid","SELECT sum(T2.balance) ,  T1.name FROM accounts AS T1 JOIN savings AS T2 ON T1.custid  =  T2.custid GROUP BY T1.name","BN1, D1a","BN1, D1a"
38,38,475,What are the ids for all sporty students who are on scholarship?,SELECT SportsInfo.StuID FROM SportsInfo,SELECT StuID FROM Sportsinfo WHERE onscholarship  =  'Y',"BN1, F4","BN1, F4"
39,39,1045,"How many songs, on average, are sung by a female artist?","SELECT COUNT(song.song_name) FROM artist JOIN song ON artist.artist_name = song.artist_name WHERE artist.gender = ""VALUE""","SELECT avg(T2.rating) FROM artist AS T1 JOIN song AS T2 ON T1.artist_name  =  T2.artist_name WHERE T1.gender  =  ""Female""","BL1, L4, D1, F4","D1, L4, F4, BL1"
40,40,868,List the document ids for any documents with the status code done and the type code paper.,"SELECT Documents.document_id FROM Documents WHERE Documents.document_status_code = ""done"" AND Documents.document_type_code = ""paper""","SELECT document_id FROM Documents WHERE document_status_code = ""done"" AND document_type_code = ""Paper"";","BL1, L4, D1, D1a","D1, L4, D1a, BL1"
41,41,1325,"Which problems are reported by the staff with first name ""Christop""? Show the descriptions of the problems.","SELECT Problems.problem_description FROM Staff JOIN Problem_Log ON Staff.staff_id = Problem_Log.assigned_to_staff_id JOIN Problems ON Problem_Log.problem_id = Problems.problem_id WHERE Staff.staff_first_name = ""Christop""","SELECT T1.problem_description FROM problems AS T1 JOIN staff AS T2 ON T1.reported_by_staff_id = T2.staff_id WHERE T2.staff_first_name = ""Christop""","E1, BE5, D1a","E1, D1a"
42,42,1291,What is the average number of hours spent practicing for students who got rejected?,SELECT AVG(Player.HS) FROM Player WHERE Player.pID IN (SELECT Tryout.decision FROM Tryout),SELECT avg(T1.HS) FROM player AS T1 JOIN tryout AS T2 ON T1.pID  =  T2.pID WHERE T2.decision  =  'no',"CE2, E1, BE5","CE2, E1, F4"
43,43,1356,How many girl students who are younger than 25?,"SELECT COUNT(*) FROM Student WHERE Student.Age < 25 AND Student.Sex = ""VALUE""",SELECT count(*) FROM student WHERE sex  =  'F' AND age  <  25,"CE2, D1","D1, F4, CE2"
44,44,1214,Show the name and phone for customers with a mailshot with outcome code 'No Response'.,"SELECT Customers.customer_name, Customers.customer_phone FROM Customers JOIN Mailshot_Customers ON Customers.customer_id = Mailshot_Customers.customer_id WHERE Mailshot_Customers.outcome_code = ""no Response""","SELECT T1.customer_name ,  T1.customer_phone FROM customers AS T1 JOIN mailshot_customers AS T2 ON T1.customer_id  =  T2.customer_id WHERE T2.outcome_code  =  'No Response'","D1, D1a","D1, D1a"
45,45,584,What is the average miles per gallon of all the cards with 4 cylinders?,SELECT AVG(cars_data.Horsepower) FROM cars_data WHERE cars_data.Cylinders = 4,SELECT avg(mpg) FROM CARS_DATA WHERE Cylinders  =  4;,"BL1, D1a","BL1, D1a"
46,46,1170,How many friends does Dan have?,"SELECT COUNT(*) FROM Person JOIN PersonFriend ON Person.name = PersonFriend.friend WHERE PersonFriend.friend = ""Dan""",SELECT count(T2.friend) FROM Person AS T1 JOIN PersonFriend AS T2 ON T1.name  =  T2.name WHERE T1.name  =  'Dan',"BL1, BE5, BF4",BE5
47,47,978,What is the average account balance of customers with credit score below 50 for the different account types?,"SELECT AVG(customer.acc_bal), customer.acc_type FROM customer WHERE customer.acc_type < 50 GROUP BY customer.acc_type","SELECT avg(acc_bal) ,  acc_type FROM customer WHERE credit_score  <  50 GROUP BY acc_type",BE5,"BL1, BE5, BF4"
48,48,1251,What are the names of all pilots 30 years old or young in descending alphabetical order?,SELECT pilot.Name FROM pilot WHERE pilot.Age >= 30,SELECT Name FROM pilot WHERE Age  <=  30 ORDER BY Name DESC,"KA1b, F1, BF4","KA1b, F1, BF4"
49,49,471,How many different types of sports do we offer?,SELECT COUNT(DISTINCT Video_Games.GType) FROM Video_Games,SELECT count(DISTINCT sportname) FROM Sportsinfo,"CL1, BL1, KA1b, F1","CL1, F1, KA1b"
50,50,380,What is average number of students enrolled in Florida colleges?,"SELECT AVG(College.enr) FROM College WHERE College.state = ""Florida""",SELECT avg(enr) FROM College WHERE state  =  'FL',"CL1, D1c, BL1","CL1, D1c"
51,51,1250,List names of all pilot aged 30 or younger in descending alphabetical order.,SELECT pilot.Name FROM pilot WHERE pilot.Age <= 30 ORDER BY pilot.Age DESC,SELECT Name FROM pilot WHERE Age  <=  30 ORDER BY Name DESC,"D1c, BN1","D1c, BN1"
52,52,883,Return the names of entrepreneurs do no not have the investor Rachel Elnaugh.,"SELECT people.Name FROM people EXCEPT SELECT people.Name FROM entrepreneur JOIN people ON entrepreneur.People_ID = people.People_ID WHERE entrepreneur.Investor = ""Rachel Elnaugh""","SELECT T2.Name FROM entrepreneur AS T1 JOIN people AS T2 ON T1.People_ID  =  T2.People_ID WHERE T1.Investor != ""Rachel Elnaugh""",F1,F1
53,53,1326,Find the ids of the problems that are reported by the staff whose last name is Bosco.,"SELECT Problem_Log.problem_id FROM Staff JOIN Problem_Log ON Staff.staff_id = Problem_Log.assigned_to_staff_id WHERE Staff.staff_last_name = ""Bosco""","SELECT T1.problem_id FROM problems AS T1 JOIN staff AS T2 ON T1.reported_by_staff_id = T2.staff_id WHERE T2.staff_last_name = ""Bosco""","A1a, BE5","BE5, A1a"
54,54,1016,Find the id and local authority of the station whose maximum precipitation is higher than 50.,"SELECT station.id, station.local_authority FROM station JOIN weekly_weather ON station.id = weekly_weather.station_id WHERE weekly_weather.precipitation > 50 ORDER BY weekly_weather.precipitation DESC LIMIT 1","SELECT t2.id ,  t2.local_authority FROM weekly_weather AS t1 JOIN station AS t2 ON t1.station_id  =  t2.id GROUP BY t1.station_id HAVING max(t1.precipitation)  >  50","BE5, F4, AN2",N3
55,55,1169,How many friends does Dan have?,"SELECT COUNT(*) FROM Person JOIN PersonFriend ON Person.name = PersonFriend.friend WHERE PersonFriend.friend = ""Dan""",SELECT count(T2.friend) FROM Person AS T1 JOIN PersonFriend AS T2 ON T1.name  =  T2.name WHERE T1.name  =  'Dan',"BE5, F4, CF5","BL1, CF5"
56,56,1392,"What are lines 1 and 2 of the addressed of the customer with the email ""vbogisich@example.org""?","SELECT Customers.address_line_1, Customers.address_line_2 FROM Customers WHERE Customers.email_address = ""vbogisich @ example.org""","SELECT address_line_1 ,  address_line_2 FROM customers WHERE email_address  =  ""vbogisich@example.org""","D1c, BE5","BL1, D1, CF5"
57,57,134,What are all the distinct participant ids who attended any events?,SELECT DISTINCT Participants_in_Events.Participant_ID FROM Participants_in_Events,SELECT count(DISTINCT participant_id) FROM participants_in_Events,"L5, D1c","L5, D1, A2a"
58,58,360,How many students are enrolled in college?,SELECT COUNT(*) FROM College,SELECT sum(enr) FROM College,"L5, BL1","L5, L4, A2a"
59,59,1043,What is the count of the songs that last approximately 4 minutes?,SELECT COUNT(*) FROM song WHERE song.releasedate = 4,"SELECT count(*) FROM files WHERE duration LIKE ""4:%""","CL1, D1, BL1","CL1, L4, CF5"
60,60,1058,What are the names of artists who are Male and are from UK?,"SELECT artist.artist_name FROM artist WHERE artist.gender = ""UK""","SELECT artist_name FROM artist WHERE country  =  ""UK"" AND gender  =  ""Male""","CL1, D1, F4","CL1, D1, CF5, F4"
61,61,652,Find the names of the products with length smaller than 3 or height greater than 5.,SELECT Catalog_Contents.product_stock_number FROM Catalog_Contents WHERE Catalog_Contents.length < 3 OR Catalog_Contents.height > 5,SELECT catalog_entry_name FROM catalog_contents WHERE LENGTH  <  3 OR width  >  5,"CL1, F4","D1, CL1, F4, BF4"
62,62,847,Are the customers holding coupons with amount 500 bad or good?,SELECT * FROM Discount_Coupons,SELECT T1.good_or_bad_customer FROM customers AS T1 JOIN discount_coupons AS T2 ON T1.coupon_id  =  T2.coupon_id WHERE T2.coupon_amount  =  500,"CL1, BL1","F4, BL2, CL1, BF4, CE2"
63,63,1067,Compute the average salary of the players in the team called 'Boston Red Stockings'.,"SELECT AVG(player_college.year) FROM player_college WHERE player_college.college_id = ""Boston Red Stockings""",SELECT avg(T1.salary) FROM salary AS T1 JOIN team AS T2 ON T1.team_id  =  T2.team_id_br WHERE T2.name  = 'Boston Red Stockings',"BL1, BF4, CF5","CF5, F4, BL2"
64,64,994,What is the total amount of money loaned by banks in New York state?,"SELECT SUM(loan.amount) FROM bank JOIN loan ON bank.branch_ID = loan.cust_ID WHERE bank.state = ""New York""",SELECT sum(T2.amount) FROM bank AS T1 JOIN loan AS T2 ON T1.branch_id  =  T2.branch_id WHERE T1.state  =  'New York',"CL1, BL1, BE5, BF4","CL1, CE2, CF5, BE5"
65,65,998,"List all every engineer's first name, last name, details and coresponding skill description.","SELECT Maintenance_Engineers.first_name, Maintenance_Engineers.last_name, Skills.skill_description FROM Maintenance_Engineers JOIN Engineer_Skills ON Maintenance_Engineers.engineer_id = Engineer_Skills.engineer_id JOIN Skills ON Engineer_Skills.skill_id = Skills.skill_id","SELECT T1.first_name ,  T1.last_name ,  T1.other_details ,  T3.skill_description FROM Maintenance_Engineers AS T1 JOIN Engineer_Skills AS T2 ON T1.engineer_id  =  T2.engineer_id JOIN Skills AS T3 ON T2.skill_id  =  T3.skill_id","BE5, BL3","BE5, BL3"
66,66,709,What are the ids and trade names of the medicine that can interact with at least 3 enzymes?,"SELECT medicine.id, medicine.name FROM medicine_enzyme_interaction JOIN medicine ON medicine_enzyme_interaction.medicine_id = medicine.id GROUP BY medicine_enzyme_interaction.medicine_id HAVING COUNT(*) >= 3","SELECT T1.id ,  T1.trade_name FROM medicine AS T1 JOIN medicine_enzyme_interaction AS T2 ON T2.medicine_id  =  T1.id GROUP BY T1.id HAVING COUNT(*)  >=  3","BN1, BL3","BL1, BN1, BL3"
67,67,692,How many tracks are in the AAC audio file media type?,"SELECT COUNT(*) FROM Track JOIN MediaType ON Track.MediaTypeId = MediaType.MediaTypeId WHERE MediaType.Name = ""AAC audio file media""","SELECT COUNT(*) FROM MEDIATYPE AS T1 JOIN TRACK AS T2 ON T1.MediaTypeId  =  T2.MediaTypeId WHERE T1.Name  =  ""AAC audio file""","D1c, BN1","CL1, D1c, BN1"
68,68,1239,What are the full names and gradepoints for all enrollments?,"SELECT Student.Fname, Student.LName, Enrolled_in.Grade FROM Enrolled_in JOIN Student ON Enrolled_in.StuID = Student.StuID","SELECT T3.Fname ,  T3.LName ,  T2.gradepoint FROM ENROLLED_IN AS T1 JOIN GRADECONVERSION AS T2 JOIN STUDENT AS T3 ON T1.Grade  =  T2.lettergrade AND T1.StuID  =  T3.StuID","D1c, CE2, BL1","BE5, CL1, CE2, D1c"
69,69,1242,What are the first names and last names of the students that minor in the department with DNO 140.,"SELECT Student.Fname, Student.LName FROM Minor_in JOIN Student ON Minor_in.StuID = Student.StuID WHERE Student.Major = 140","SELECT T2.Fname ,  T2.Lname FROM MINOR_IN AS T1 JOIN STUDENT AS T2 ON T1.StuID  =  T2.StuID WHERE T1.DNO  =  140","CE2, CF5, BF4, CL1","CE2, CF5, CL1, BE5"
70,70,917,Find the names of the candidates whose support percentage is lower than their oppose rate.,SELECT people.Name FROM candidate JOIN people ON candidate.People_ID = people.People_ID WHERE candidate.Support_rate < (SELECT MIN(candidate.Support_rate) FROM candidate),SELECT t1.name FROM people AS t1 JOIN candidate AS t2 ON t1.people_id  =  t2.people_id WHERE t2.support_rate  <  t2.oppose_rate,CF5,"F3, CF5"
71,71,1225,What are the rooms for members of the faculty who are professors and who live in building NEB?,"SELECT DISTINCT Faculty.Room FROM Faculty JOIN Member_of ON Faculty.FacID = Member_of.FacID JOIN Department ON Member_of.DNO = Department.DNO WHERE Faculty.Rank = ""VALUE"" AND Faculty.Building = ""NEB""","SELECT Room FROM FACULTY WHERE Rank  =  ""Professor"" AND Building  =  ""NEB""","D1, E1, A2a, BF4","F3, D1, E1, A2a"
72,72,1146,"What are the titles and studios of films that have been produced by a studio whose name contains ""Universal""?","SELECT film.Title, film.Director FROM film WHERE film.Studio LIKE ""% Universal %""","SELECT title ,  Studio FROM film WHERE Studio LIKE ""%Universal%""","E1, A2a","BL1, E1, D1, A2a"
73,73,392,What is the count of states with college students playing in the mid position but not as goalies?,"SELECT COUNT(*) FROM Tryout WHERE Tryout.pPos = ""mid"" AND Tryout.pPos != ""goalies""",SELECT COUNT(*) FROM (SELECT T1.state FROM college AS T1 JOIN tryout AS T2 ON T1.cName  =  T2.cName WHERE T2.pPos  =  'mid' EXCEPT SELECT T1.state FROM college AS T1 JOIN tryout AS T2 ON T1.cName  =  T2.cName WHERE T2.pPos  =  'goalie'),"CE2, D1","BL1, A1d"
74,74,1096,List the physicians' employee ids together with their primary affiliation departments' ids.,"SELECT Physician.EmployeeID, Affiliated_With.PrimaryAffiliation FROM Physician JOIN Affiliated_With ON Physician.EmployeeID = Affiliated_With.Physician WHERE Affiliated_With.Department = ""id""","SELECT physician ,  department FROM affiliated_with WHERE primaryaffiliation  =  1","CE2, E1, D1a, CL1","D1, E1, CL1, A1d"
75,75,547,How many lessons were in cancelled state?,"SELECT COUNT(*) FROM Lessons WHERE Lessons.lesson_status_code = ""cancelled""","SELECT count(*) FROM Lessons WHERE lesson_status_code = ""Cancelled"";","E1, CL1","D1, E1, CL1, D1a"
76,76,771,"Show the id, the account name, and other account details for all accounts by the customer with first name 'Meaghan'.","SELECT Accounts.account_id, Accounts.account_name, Accounts.other_account_details FROM Customers JOIN Accounts ON Customers.customer_id = Accounts.customer_id WHERE Customers.customer_first_name = ""Meaghan""","SELECT T1.account_id ,  T1.date_account_opened ,  T1.account_name ,  T1.other_account_details FROM Accounts AS T1 JOIN Customers AS T2 ON T1.customer_id  =  T2.customer_id WHERE T2.customer_first_name  =  'Meaghan'","BL3, D1a","BL3, D1a"
77,77,806,"What are the different product names, and what is the sum of quantity ordered for each product?","SELECT Products.product_name, SUM(Order_Items.product_quantity) FROM Order_Items JOIN Products ON Order_Items.product_id = Products.product_id GROUP BY Order_Items.product_id","SELECT T2.product_name ,  sum(T1.product_quantity) FROM Order_items AS T1 JOIN Products AS T2 ON T1.product_id  =  T2.product_id GROUP BY T2.product_name","BN1, BL3","CF5, BL3"
