,sql_id,nl_query,sql,GT_sql,zhengn,record_id_y,error_classification_y
199,1261,How many project staff worked as leaders or started working before '1989-04-24 23:51:54'?,SELECT COUNT( * ) FROM project_staff WHERE project_staff.role_code = 'leaders' OR project_staff.date_from<'1989-04-24 23:51:54',SELECT count(*) FROM Project_Staff WHERE role_code  =  'leader' OR date_from  <  '1989-04-24 23:51:54',zhengning,b7dcd032-2a12-4082-859b-103bf6278d1e,D1b
200,1171,Which channels are broadcast in the morning? Give me the channel names.,SELECT channel.name FROM channel JOIN broadcast ON channel.channel_id = broadcast.channel_id WHERE broadcast.time_of_day = 'morning',SELECT t1.name FROM channel AS t1 JOIN broadcast AS t2 ON t1.channel_id  =  t2.channel_id WHERE t2.time_of_day  =  'Morning',zhengning,8993ac56-2630-4b58-875a-a7dee390e8b6,D1a
201,242,How many Bangladeshi artists are listed?,"SELECT COUNT( * ) FROM artist WHERE artist.country NOT IN (SELECT * FROM artist, artist WHERE artist.country = 'Bangladeshi artists')","SELECT count(*) FROM artist WHERE country  =  ""Bangladesh""",zhengning,8fffa0a8-314e-4228-b419-360b22d0df9f,"A1a, D1"
202,1124,What are first and last names of players participating in all star game in 1998?,"SELECT player.bats , player.bats FROM player JOIN all_star ON player.player_id = all_star.player_id WHERE all_star.year = 1998","SELECT name_first ,  name_last FROM player AS T1 JOIN all_star AS T2 ON T1.player_id  =  T2.player_id WHERE YEAR  =  1998",zhengning,64cbccd1-6539-44bc-b2e7-3d8e8d0ce062,BL1
203,1225,Show the names of companies in the banking or retailing industry?,SELECT company.name FROM company WHERE company.industry = 'banking' OR company.industry = 'retailing',"SELECT Name FROM company WHERE Industry  =  ""Banking"" OR Industry  =  ""Retailing""",zhengning,11fab195-175b-4e25-b4d6-88d0bb5a96d5,D1a
204,2171,Find the name of the person who has no student friends.,SELECT person.name FROM person WHERE person.name NOT IN (SELECT personfriend.name FROM personfriend WHERE personfriend.friend = 'student'),SELECT name FROM person EXCEPT SELECT T2.name FROM Person AS T1 JOIN PersonFriend AS T2 ON T1.name  =  T2.friend WHERE T1.job  =  'student',zhengning,d5d780ef-8f0d-4041-9dd0-cca304713f92,A1d
205,1300,What are the names of all friends who are from New York?,SELECT personfriend.name FROM person JOIN personfriend ON person.name = personfriend.friend WHERE person.city = 'New York',SELECT T2.name FROM Person AS T1 JOIN PersonFriend AS T2 ON T1.name  =  T2.friend WHERE T1.city  =  'new york city',zhengning,5551014a-0422-45ff-82f2-4190114c2934,D1c
206,245,How many parks are there in the state of NY?,SELECT COUNT( * ) FROM college WHERE college.state = 'NY',SELECT count(*) FROM park WHERE state  =  'NY';,zhengning,6c0b2535-8c03-4a82-bde3-c55e56f02bfb,CL1
207,682,What are the ids of all tv channels that have more than 2 TV channels?,SELECT tv_channel.id FROM tv_channel JOIN tv_series ON tv_channel.id = tv_series.channel GROUP BY tv_channel.id HAVING COUNT( * ) > 2,SELECT id FROM tv_channel GROUP BY country HAVING count(*)  >  2,zhengning,aea7d04a-4b9e-4a5b-8d71-14168cdbe6dc,"BN1, E1"
208,1742,What is the number of makers of care in France?,SELECT COUNT( * ) FROM car_makers JOIN countries ON car_makers.country = countries.countryid JOIN car_makers ON car_makers.country = countries.countryid JOIN model_list ON car_makers.id = model_list.maker JOIN countries ON countries.countryid = countries.continent WHERE countries.countryname = 'France' AND countries.countryname = 'France',SELECT count(*) FROM CAR_MAKERS AS T1 JOIN COUNTRIES AS T2 ON T1.Country  =  T2.CountryId WHERE T2.CountryName  =  'france';,zhengning,a64120af-970f-4cdb-9201-45cff1645f9e,"E1, D1a"
209,966,What are the average height and weight across males (sex is M)?,"SELECT AVG( people.height ) , AVG( people.weight ) FROM people WHERE people.sex = 'm'","SELECT avg(height) ,  avg(weight) FROM people WHERE sex  =  'M'",zhengning,7da95058-75cb-4b97-a5c6-8ba17b3952a3,D1a
210,705,"Which catalog contents have a product stock number that starts from ""2""? Show the catalog entry names.",SELECT catalog_contents.catalog_entry_name FROM catalog_contents WHERE catalog_contents.product_stock_number LIKE '%2%',"SELECT catalog_entry_name FROM catalog_contents WHERE product_stock_number LIKE ""2%""",zhengning,c799c3e9-59fe-411a-abb6-6f64e193a62d,D1c
211,1586,Show all locations that have train stations with at least 15 platforms and train stations with more than 25 total passengers.,SELECT station.location FROM station WHERE station.number_of_platforms >= 15 AND station.total_passengers > 25,SELECT DISTINCT LOCATION FROM station WHERE number_of_platforms  >=  15 AND total_passengers  >  25,zhengning,4cb1262c-ae0b-40a4-845f-d96a3005496f,A1b
212,354,How many patents outcomes were listed for all the projects?,SELECT COUNT( * ) FROM project_outcomes WHERE project_outcomes.outcome_code = 'patents',SELECT count(*) FROM Project_outcomes WHERE outcome_code  =  'Patent',zhengning,8b3ab267-02d8-4011-aa7e-acc3f4453ec8,"D1a, D1b"
213,249,How many parks are there in Atlanta city?,SELECT COUNT( * ) FROM college WHERE college.city = 'Atlanta',SELECT count(*) FROM park WHERE city = 'Atlanta';,zhengning,252522e3-e3b9-441a-8ef1-7eb5ae09161c,CL1
214,250,How many parks does Atlanta city have?,SELECT COUNT( * ) FROM park WHERE college.city = 'Atlanta',SELECT count(*) FROM park WHERE city = 'Atlanta';,zhengning,2acad5e8-2c85-41ed-bc19-67130a164349,CF5
215,1598,When did the staff member named Janessa Sawayn join the company?,SELECT staff.date_joined_staff FROM staff WHERE staff.nickname = 'Janessa Sawayn',"SELECT date_joined_staff FROM Staff WHERE first_name = ""Janessa"" AND last_name = ""Sawayn"";",zhengning,a8d6c828-379c-4a3b-9579-bdd47c143709,"F2, D1"
216,2327,What are the ids of documents with the type code CV that do not have expenses.,SELECT documents_with_expenses.document_id FROM documents_with_expenses INTERSECT SELECT documents.document_id FROM documents WHERE documents.document_type_code = 'CV',"SELECT document_id FROM Documents WHERE document_type_code  =  ""CV"" EXCEPT SELECT document_id FROM Documents_with_expenses",zhengning,f79b45a4-d0fb-471f-bf4b-a598b50cb028,A1d
217,1329,"What are the last names of faculty in building Barton, sorted by last name?","SELECT faculty.lname FROM faculty WHERE faculty.building = 'Barton,' ORDER BY faculty.lname ASC","SELECT Lname FROM FACULTY WHERE Building  =  ""Barton"" ORDER BY Lname",zhengning,90305738-f6dc-41a7-ad6a-e9504e6bef57,D1c
218,2214,Which colleges do the tryout players whose name starts with letter D go to?,SELECT tryout.cname FROM tryout JOIN player ON tryout.pid = player.pid WHERE player.pname LIKE '%D%',SELECT T1.cName FROM  tryout AS T1 JOIN player AS T2 ON T1.pID  =  T2.pID WHERE T2.pName LIKE 'D%',zhengning,512353a2-e2e6-4a7f-ac12-5734e6fe0e26,D1c
219,1323,What are the full names of faculties with sex M and who live in building NEB?,"SELECT faculty.fname , faculty.lname FROM faculty WHERE faculty.sex = 'm' AND faculty.building = 'NEB'","SELECT Fname ,  Lname FROM FACULTY WHERE sex  =  ""M"" AND Building  =  ""NEB""",zhengning,3d117242-c69e-472b-a29c-8010433063eb,D1a
220,2150,What are the details for all projects that did not hire any staff in a research role?,SELECT projects.project_details FROM projects JOIN project_staff ON projects.project_id = project_staff.project_id WHERE project_staff.role_code = (SELECT project_staff.project_id FROM project_staff UNION SELECT project_staff.role_code FROM project_staff),SELECT project_details FROM Projects WHERE project_id NOT IN ( SELECT project_id FROM Project_Staff WHERE role_code  =  'researcher' ),zhengning,b2924c8f-5e49-402b-b9e0-c0fcba442951,"F4, E1"
221,1877,"What are the names, checking balances, and savings balances of customers, ordered by the total of checking and savings balances descending?","SELECT checking.balance , checking.balance , accounts.name , SUM( savings.balance ) FROM accounts JOIN checking ON accounts.custid = checking.custid JOIN savings ON accounts.custid = savings.custid ORDER BY checking.balance , accounts.name ASC","SELECT T2.balance ,  T3.balance ,  T1.name FROM accounts AS T1 JOIN checking AS T2 ON T1.custid  =  T2.custid JOIN savings AS T3 ON T1.custid  =  T3.custid ORDER BY T2.balance + T3.balance DESC",zhengning,4a60fb40-4580-4717-8ab9-fa9e8337c652,"L4, K2"
222,2045,Which department has the largest number of employees?,SELECT department.name FROM department GROUP BY department.name ORDER BY COUNT( * ) DESC LIMIT 1,SELECT name FROM department GROUP BY departmentID ORDER BY count(departmentID) DESC LIMIT 1;,zhengning,94043e34-3704-42c7-ab29-550ac7d6ec58,BN1
223,474,What are the different membership levels?,SELECT DISTINCT member.level FROM member,SELECT count(DISTINCT LEVEL) FROM member,zhengning,e2db80e0-bcab-4ba3-be37-7c55c79656e3,L5
224,270,find the number of different programs that are broadcast during night time.,SELECT COUNT( DISTINCT broadcast.program_id ) FROM broadcast WHERE broadcast.time_of_day = 'night',SELECT count(DISTINCT program_id) FROM broadcast WHERE time_of_day  =  'Night',zhengning,c2226c02-367c-4240-98be-dd0da568f6ee,D1a
225,985,Show the lieutenant governor and comptroller from the democratic party.,"SELECT party.lieutenant_governor , party.comptroller FROM party WHERE party.party = 'democratic'","SELECT Lieutenant_Governor ,  Comptroller FROM party WHERE Party  =  ""Democratic""",zhengning,dcbcf920-db58-41db-9064-9f0ac958c43e,D1a
226,1701,Find the invoice numbers which are created before 1989-09-03 or after 2007-12-25.,SELECT invoices.invoice_number FROM invoices WHERE invoices.invoice_date > '1989-09-03' OR invoices.invoice_date<'2007-12-25',"SELECT invoice_number FROM invoices WHERE invoice_date < ""1989-09-03"" OR invoice_date > ""2007-12-25""",zhengning,a4f4a41c-39c2-4a88-93db-ea544784a2fd,F1
227,1703,Find the distinct details of invoices which are created before 1989-09-03 or after 2007-12-25.,SELECT DISTINCT invoices.invoice_details FROM invoices WHERE invoices.invoice_date > '1989-09-03' OR invoices.invoice_date<'2007-12-25',"SELECT DISTINCT invoice_details FROM invoices WHERE invoice_date < ""1989-09-03"" OR invoice_date > ""2007-12-25""",zhengning,d899e660-dba2-4969-95b1-9f6fafda780b,F1
228,1984,What are the names of the singers who sang the top 3 most highly rated songs and what countries do they hail from?,"SELECT artist.country , artist.artist_name FROM artist , song ORDER BY song.rating DESC LIMIT 3","SELECT T1.artist_name ,  T1.country FROM artist AS T1 JOIN song AS T2 ON T1.artist_name  =  T2.artist_name ORDER BY T2.rating DESC LIMIT 3",zhengning,4c241238-3cd3-46f8-a225-e35d10407885,CE2
229,575,How many budget types do we have?,SELECT COUNT( DISTINCT ref_budget_codes.budget_type_code ) FROM ref_budget_codes,SELECT count(*) FROM Ref_budget_codes,zhengning,e6b29309-2350-489a-a663-0142849a8803,A2a
230,2029,List three countries which are the origins of the least players.,SELECT player.birth_city FROM player GROUP BY player.birth_city ORDER BY COUNT( * ) ASC LIMIT 3,SELECT birth_country FROM player GROUP BY birth_country ORDER BY count(*) ASC LIMIT 3;,zhengning,165649f2-2c05-4e0d-a361-32a6af8b0131,BL1
231,1140,"How many games in 1885 postseason resulted in ties (that is, the value of ""ties"" is '1')?",SELECT COUNT( * ) FROM postseason WHERE postseason.losses = 1885 AND postseason.ties = 1,SELECT count(*) FROM postseason WHERE YEAR  =  1885 AND ties  =  1;,zhengning,653675e0-44b2-4708-9fff-5c4831d65365,BF4
232,2356,List the name and count of each product in all orders.,"SELECT products.product_name , COUNT( * ) FROM products JOIN order_items ON products.product_id = order_items.product_id GROUP BY products.product_name","SELECT T3.product_name ,  count(*) FROM orders AS T1 JOIN order_items AS T2 JOIN products AS T3 ON T1.order_id = T2.order_id AND T2.product_id = T3.product_id GROUP BY T3.product_id",zhengning,e4bfe310-59cd-449b-ac3f-21790e2c536e,"CL1, CE2, BN1"
233,1993,Find the distinct names of all songs that have a higher resolution than some songs in English.,SELECT DISTINCT song.song_name FROM song WHERE song.resolution > (SELECT MIN( song.resolution ) FROM song WHERE song.languages = 'English'),"SELECT DISTINCT song_name FROM song WHERE resolution  >  (SELECT min(resolution) FROM song WHERE languages  =  ""english"")",zhengning,6aa07439-22de-472e-9b6f-0cd0868c8d6b,D1a
234,2329,Give the ids of documents that have expenses and contain the letter s in their names.,SELECT DISTINCT documents.document_name FROM documents_with_expenses JOIN documents ON documents_with_expenses.document_id = documents.document_id WHERE documents.document_name LIKE '%s%',SELECT T1.document_id FROM Documents AS T1 JOIN Documents_with_expenses AS T2 ON T1.document_id  =  T2.document_id WHERE T1.document_name LIKE '%s%',zhengning,7b6d86b8-39ee-4a34-88f9-1c47299ca837,"A2a, BL1"
235,2185,What are the last names of faculty who are part of the computer science department?,SELECT faculty.lname FROM faculty JOIN member_of ON faculty.facid = member_of.facid JOIN department ON member_of.dno = department.dno WHERE department.dname = 'computer science',"SELECT T2.Lname FROM DEPARTMENT AS T1 JOIN FACULTY AS T2 ON T1.DNO  =  T3.DNO JOIN MEMBER_OF AS T3 ON T2.FacID  =  T3.FacID WHERE T1.DName  =  ""Computer Science""",zhengning,da36d8af-6480-428b-9966-dafacb02d094,D1a
236,614,What are the names of all airports whose elevation is between -50 and 50?,SELECT airports.name FROM airports WHERE airports.elevation BETWEEN 50 and 50,SELECT name FROM airports WHERE elevation BETWEEN -50 AND 50,zhengning,04fbe2ce-844c-4763-9315-5885e535966d,D1
237,1576,Show the budget type code and description and the corresponding document id.,"SELECT ref_budget_codes.budget_type_code , documents.document_description , documents.document_id FROM documents , ref_budget_codes , ref_document_types","SELECT T2.budget_type_code ,  T2.budget_type_description ,  T1.document_id FROM Documents_with_expenses AS T1 JOIN Ref_budget_codes AS T2 ON T1.budget_type_code  =  T2.budget_type_code",zhengning,5f499015-21f0-4a0d-99df-515fb0ddbf7b,"BL3, CL1, CE2"