,Unnamed: 0,sql_id,nl_query,sql,GT_sql,tianyi,record_id_x,tianyi_code,zhengn,record_id_y,zhengn_code
117,117,2035,List the 3 highest salaries of the players in 2001?,SELECT park.city FROM college WHERE college.city = 2001,SELECT salary FROM salary WHERE YEAR  =  2001 ORDER BY salary DESC LIMIT 3;,tianyi,db30585b-965e-4d73-8d98-8e782534908b,"BL1, KA1b",zhengning,6ea70a8f-413d-42b8-b2f3-bfa63199459b,"KA1b, CL1"
118,118,2338,"List lesson id of all lessons taught by staff with first name as Janessa, last name as Sawayn and nickname containing letter 's'.","SELECT lessons.lesson_id FROM lessons JOIN staff ON lessons.staff_id = staff.staff_id WHERE staff.first_name = 'Janessa, last name as Sawayn' AND staff.last_name = 's'","SELECT T1.lesson_id FROM Lessons AS T1 JOIN Staff AS T2 ON T1.staff_id = T2.staff_id WHERE T2.first_name = ""Janessa"" AND T2.last_name = ""Sawayn"" AND nickname LIKE ""%s%"";",tianyi,45396211-5460-47ab-8458-86df86067136,"D1, D1",zhengning,494fe257-50b0-4416-ad33-3588f7f16663,"D1, BF4"
119,119,1115,What are the names of all male British artists?,SELECT artist.artist_name FROM artist WHERE artist.gender = 'male' AND artist.gender = 'male',"SELECT artist_name FROM artist WHERE country  =  ""UK"" AND gender  =  ""Male""",tianyi,53641903-dd2e-4457-991f-1a987ad29040,F4,zhengning,1f9446af-9b9f-4ae8-a16b-95e9fd118943,"F4, F3, D1a"
120,120,284,What are the unique block codes that have available rooms?,SELECT DISTINCT room.blockcode FROM room WHERE room.unavailable = 1,SELECT DISTINCT blockcode FROM room WHERE unavailable  =  0,tianyi,ddc18010-39c0-4f9c-9077-c80ca262dcf7,D1,zhengning,229aa611-9432-4257-a168-300f80b492b2,D1
121,121,686,Show the name and number of employees for the departments managed by heads whose temporary acting value is 'Yes'?,"SELECT department.name , department.num_employees FROM department JOIN management ON department.department_id = management.department_id WHERE management.temporary_acting = 'yes'","SELECT T1.name ,  T1.num_employees FROM department AS T1 JOIN management AS T2 ON T1.department_id  =  T2.department_id WHERE T2.temporary_acting  =  'Yes'",tianyi,9df7bab3-88ce-4e6a-a390-6136a33f3a54,D1a,zhengning,b6914bcc-588d-45cf-87bd-97637daa8fc2,D1a
122,122,2017,What are the names of the songs whose rating is below the rating of all songs in English?,SELECT song.song_name FROM song WHERE song.rating<(SELECT MIN( song.rating ) FROM song WHERE song.languages = 'English'),SELECT song_name FROM song WHERE rating  <   (SELECT min(rating) FROM song WHERE languages  =  'english'),tianyi,837a992a-090c-46f8-a113-60de79f50465,D1a,zhengning,10d904cc-d729-493d-9183-38023ea4a161,D1a
123,123,2157,What are all the details of the organisations described as 'Sponsor'? Sort the result in an ascending order.,SELECT organisations.organisation_details FROM organisations WHERE organisations.organisation_type = 'Sponsor' ORDER BY organisations.organisation_details ASC,SELECT organisation_details FROM Organisations AS T1 JOIN organisation_Types AS T2 ON T1.organisation_type  =  T2.organisation_type WHERE T2.organisation_type_description  =  'Sponsor' ORDER BY organisation_details,tianyi,9a190165-4141-40f6-8030-f0d6b225e1b5,"CE2, BF4, CF5",zhengning,b3236864-4fec-42fd-b1e6-2b43d6d11120,"CE2, BF4"
124,124,1833,Find the founded year of the newest non public school.,SELECT university.founded FROM university WHERE university.affiliation != 'public' ORDER BY university.founded ASC LIMIT 1,SELECT founded FROM university WHERE affiliation != 'Public' ORDER BY founded DESC LIMIT 1,tianyi,b7ea7a94-b702-45d6-ad30-fc7b764c3e99,"D1a, K2",zhengning,e3823dc2-e398-4ca5-82fa-68c56bb9ef7f,"K2, D1a"
125,125,2158,What are the details of all organizations that are described as Sponsors and sort the results in ascending order?,SELECT organisations.organisation_details FROM organisations WHERE organisations.organisation_type = 'Sponsors' ORDER BY organisations.organisation_details ASC,SELECT organisation_details FROM Organisations AS T1 JOIN organisation_Types AS T2 ON T1.organisation_type  =  T2.organisation_type WHERE T2.organisation_type_description  =  'Sponsor' ORDER BY organisation_details,tianyi,75771b51-1741-4a76-833d-31d66c1b956f,"CE2, D1b",zhengning,14a3cbd3-8471-4a55-ba59-c5bab1aabe88,"D1c, CE2"
126,126,1136,List the maximum scores of the team Boston Red Stockings when the team won in postseason?,SELECT MAX( postseason.league_id_loser ) FROM postseason JOIN team ON postseason.team_id_loser = team.team_id_br WHERE team.name = 'Boston Red Stockings',SELECT max(T1.wins) FROM postseason AS T1 JOIN team AS T2 ON T1.team_id_winner  =  T2.team_id_br WHERE T2.name  =  'Boston Red Stockings';,tianyi,c9720f21-4b27-4d16-bdfb-b49233968f19,"BL1, BE5",zhengning,08390797-7063-48fd-bd55-cc026f141c6d,"BL1, BE5"
127,127,1562,Show the statement detail and the corresponding document name for the statement with detail 'Private Project'.,"SELECT statements.statement_details , documents.document_name FROM statements JOIN documents ON statements.statement_id = documents.document_id WHERE projects.project_details = 'Private Project'","SELECT T1.statement_details ,  T2.document_name FROM Statements AS T1 JOIN Documents AS T2 ON T1.statement_id  =  T2.document_id WHERE T1.statement_details  =  'Private Project'",tianyi,ea3bbb27-27ff-4404-a63f-d1fa3b4bc8e5,"BF4, CF5",zhengning,27277d0a-024c-4895-a7bf-99a62f8d6bae,CF5
128,128,1736,"What is the full name of each car maker, along with its id and how many models it produces?","SELECT car_makers.fullname , COUNT( * ) FROM model_list JOIN car_makers ON model_list.maker = car_makers.id GROUP BY car_makers.id",,,,,,,
